,项目批准号,项目类别,学科分类,项目名称,立项时间,项目负责人,专业职务,工作单位,单位类别,所在省区市,所属系统,成果名称,成果形式,成果等级,结项时间,结项证书号,出版社,出版时间,作者,获奖情况
2,14BGL169,一般项目,管理学,军队科研院所军民融合式科技成果转化模式研究,2014-06-15,李宏伟,正高级,武警后勤学院,非985非211,军队,军队系统,,,,,,,,,
3,14XGL009,西部项目,管理学,我军信息化建设推进中基于思想互联的知识管理研究,2014-06-15,王玉云,正高级,重庆通信学院,非985非211,军队,军队系统,,,,,,,,,
4,14BGL142,一般项目,管理学,基于单病种的家庭医生重点慢性病管理绩效支付模型研究,2014-06-15,刘丽娟,副高级,第二军医大学,211非985,军队,军队系统,,,,,,,,,
5,14CGL078,青年项目,管理学,民营企业融入装备建设领域研究,2014-06-15,李晓松,中级,总装备部,,军队,军队系统,,,,,,,,,
6,14BGL137,一般项目,管理学,青藏高原多灾种自然灾害综合风险评估及其管理研究,2014-06-15,王世金,中级,中国科学院,,甘肃,其他,,,,,,,,,
7,14BGL096,一般项目,管理学,新型城镇化背景下农村能源需求结构与供给模式研究,2014-06-15,王飞,副高级,农业部,,机关,其他,,,,,,,,,
8,14BGL125,一般项目,管理学,基于上海学业水平考试和PISA测评数据的综合素质评价研究,2014-06-15,王鼎,副高级,上海市教育考试院,,上海,其他,,,,,,,,,
9,14CGL007,青年项目,管理学,市场导向机制下的企业创新轨道研究,2014-06-15,熊鸿儒,中级,中国（海南）改革发展研究院,,海南,其他,,,,,,,,,
10,14CGL045,青年项目,管理学,新型城镇化背景下中央与地方公共职责分工体系研究,2014-06-15,张飞,中级,中国（海南）改革发展研究院,,海南,其他,新型城镇化背景下中央与地方公共职责分工体系研究,专著,合格,2017-05-09,20170851.0,,0000-00-00,,
11,14XGL010,西部项目,管理学,扩大中等收入群体的公共财政制度与政策选择研究,2014-06-15,何冬妮,副高级,中国（海南）改革发展研究院,,海南,其他,,,,,,,,,
12,14AGL011,重点项目,管理学,企业环境资源与价值报告研究,2014-06-15,周守华,正高级,中国会计学会,,机关,其他,,,,,,,,,
13,14BGL112,一般项目,管理学,供需方视角下政府对公立医院投入的对比研究,2014-06-15,张培林,正高级,重庆市第九人民医院,,重庆,其他,供需方视角下政府对公立医院投入的对比研究,研究报告,良好,2017-01-18,20170133.0,,0000-00-00,,
14,14BGL099,一般项目,管理学,生态文明视域下国家低碳创新体系建设研究,2014-06-15,陆小成,副高级,北京市社会科学院,,北京,省、市社会科学院,,,,,,,,,
15,14CGL003,青年项目,管理学,我国科技服务业自主创新体系国际化发展模式与政策选择研究,2014-06-15,朱相宇,中级,北京市社会科学院,,北京,省、市社会科学院,,,,,,,,,
16,14BGL028,一般项目,管理学,利率市场化后的央行基准利率问题研究,2014-06-15,刘义圣,正高级,福建社会科学院,,福建,省、市社会科学院,,,,,,,,,
17,14CGL052,青年项目,管理学,生态保护红线政策背景下的区域治理研究,2014-06-15,林丹,副高级,贵州省社会科学院,,贵州,省、市社会科学院,,,,,,,,,
18,14BGL212,一般项目,管理学,网络突发事件的非对称性困境及其处置机制研究,2014-06-15,谢晶仁,正高级,湖南省社会科学院,,湖南,省、市社会科学院,,,,,,,,,
19,14BGL006,一般项目,管理学,垄断对中国产业升级的影响效应及规制性措施研究,2014-06-15,黄南,正高级,南京市社会科学院,,江苏,省、市社会科学院,,,,,,,,,
,项目批准号,项目类别,学科分类,项目名称,立项时间,项目负责人,专业职务,工作单位,单位类别,所在省区市,所属系统,成果名称,成果形式,成果等级,结项时间,结项证书号,出版社,出版时间,作者,获奖情况
0,14XGL012,西部项目,管理学,以西安起点为龙头的丝绸之路文化旅游研究,2014-06-15,张燕,正高级,陕西省社会科学院,,陕西,省、市社会科学院,,,,,,,,,
1,14CGL059,青年项目,管理学,小微文化企业孵化集聚的组织生态环境研究,2014-06-15,孙洁,中级,上海社会科学院,,上海,省、市社会科学院,,,,,,,,,
2,14BGL135,一般项目,管理学,基于地震预警技术的减灾应急管理创新研究,2014-06-15,廖果,副高级,四川省社会科学院,,四川,省、市社会科学院,,,,,,,,,
3,14BGL086,一般项目,管理学,全球分工新体系下的中国旅游业国际地位评估与提升研究,2014-06-15,金准,副高级,中国社会科学院,,社科院,中国社会科学院,,,,,,,,,
4,14BGL145,一般项目,管理学,医保付费机制创新与公立医院改革研究,2014-06-15,朱恒鹏,正高级,中国社会科学院,,社科院,中国社会科学院,,,,,,,,,
5,14CGL065,青年项目,管理学,环境约束、空间外溢效应与我国企业技术创新效率提升研究,2014-06-15,肖仁桥,中级,安徽财经大学,非985非211,安徽,高等院校、其他学校,,,,,,,,,
6,14BGL012,一般项目,管理学,生产性服务业发展与中国全球价值链地位提升战略研究,2014-06-15,杨仁发,副高级,安徽大学,211非985,安徽,高等院校、其他学校,,,,,,,,,
7,14BGL050,一般项目,管理学,双重委托代理视角下上市家族企业高管薪酬激励研究,2014-06-15,陈家田,副高级,安徽大学,211非985,安徽,高等院校、其他学校,,,,,,,,,
8,14BGL163,一般项目,管理学,我国文化产业安全预警体系构建研究,2014-06-15,周晓宏,正高级,安徽工程大学,非985非211,安徽,高等院校、其他学校,,,,,,,,,
9,14CGL056,青年项目,管理学,徽州文化资源保护与产业融合研究,2014-06-15,秦枫,中级,安徽师范大学,非985非211,安徽,高等院校、其他学校,,,,,,,,,
10,14BGL141,一般项目,管理学,公立医院医患关系风险预警机制及危机应对体系研究,2014-06-15,何成森,正高级,安徽医科大学,非985非211,安徽,高等院校、其他学校,,,,,,,,,
11,14BGL183,一般项目,管理学,“半强制”股利政策的经济后果研究,2014-06-15,李伟,副高级,北京第二外国语学院,非985非211,北京,高等院校、其他学校,,,,,,,,,
12,14BGL188,一般项目,管理学,价值链视角下轻资产运营非线性成长研究,2014-06-15,穆林娟,正高级,北京工商大学,非985非211,北京,高等院校、其他学校,,,,,,,,,
13,14BGL113,一般项目,管理学,基于数据挖掘的地方政府廉政建设评价指标体系研究,2014-06-15,杜治洲,副高级,北京航空航天大学,211且985,高校,高等院校、其他学校,,,,,,,,,
14,14BGL039,一般项目,管理学,金字塔型控股集团的多层级公司治理与内部资本市场研究,2014-06-15,马忠,正高级,北京交通大学,211非985,高校,高等院校、其他学校,,,,,,,,,
15,14BGL034,一般项目,管理学,基于第三方风险动态监控平台的知识产权质押融资模式研究,2014-06-15,鲍新中,副高级,北京联合大学,非985非211,北京,高等院校、其他学校,,,,,,,,,
16,14BGL127,一般项目,管理学,现代职业教育中企业责任的实现机制与评价研究,2014-06-15,霍丽娟,正高级,北京师范大学,211且985,高校,高等院校、其他学校,,,,,,,,,
17,14BGL105,一般项目,管理学,单向度竞争时期我国高等教育生态治理理论研究,2014-06-15,杨延东,正高级,渤海大学,非985非211,辽宁,高等院校、其他学校,,,,,,,,,
18,14BGL179,一般项目,管理学,产业集群环境下企业技术标准形成机制研究,2014-06-15,李庆满,副高级,渤海大学,非985非211,辽宁,高等院校、其他学校,,,,,,,,,
19,14BGL067,一般项目,管理学,中国品牌跨国并购后的国际化嵌入及其作用机制研究,2014-06-15,刘洪深,中级,长沙理工大学,非985非211,湖南,高等院校、其他学校,,,,,,,,,
,项目批准号,项目类别,学科分类,项目名称,立项时间,项目负责人,专业职务,工作单位,单位类别,所在省区市,所属系统,成果名称,成果形式,成果等级,结项时间,结项证书号,出版社,出版时间,作者,获奖情况
0,14BGL160,一般项目,管理学,基于TOD模式的城市轨道交通与沿线土地可持续协调发展研究,2014-06-15,唐文彬,副高级,长沙理工大学,非985非211,湖南,高等院校、其他学校,,,,,,,,,
1,14BGL080,一般项目,管理学,就业能力视角下的新生代农民工失业和离职问题研究,2014-06-15,李群,副高级,常州大学,,江苏,高等院校、其他学校,供给侧改革视阈下就业能力对新生代农民工失业与离职的影响机制研究,论文集,合格,2017-03-06,20170500.0,,0000-00-00,,
2,14BGL097,一般项目,管理学,用水效率异质特征下跨区域多部门水权配置及政策模拟研究,2014-06-15,佟金萍,副高级,常州大学,非985非211,江苏,高等院校、其他学校,,,,,,,,,
3,14CGL064,青年项目,管理学,基于双重网络嵌入的海归创业企业成长机制研究,2014-06-15,彭伟,中级,常州大学,,江苏,高等院校、其他学校,基于双重网络嵌入的海归创业企业成长机制研究,专著,优秀,2017-05-16,20170800.0,,0000-00-00,,
4,14XGL013,西部项目,管理学,农户风险应对机制的变迁及其对农业生产经营效率的影响研究,2014-06-15,王阳,副高级,成都信息工程学院,非985非211,四川,高等院校、其他学校,,,,,,,,,
5,14BGL152,一般项目,管理学,电子商务与西部区域经济系统协同发展机制研究,2014-06-15,施莉,正高级,成都信息工程学院,非985非211,四川,高等院校、其他学校,,,,,,,,,
6,14BGL124,一般项目,管理学,新型城镇化进程中农业转移人口市民化协同推进机制研究,2014-06-15,王丽丽,正高级,大连理工大学,211且985,辽宁,高等院校、其他学校,,,,,,,,,
7,14BGL014,一般项目,管理学,战略性新兴产业的生态位培育机制与政策研究,2014-06-15,孙晓华,副高级,大连理工大学,,辽宁,高等院校、其他学校,战略性新兴产业的生态位培育机制与政策研究,论文集,合格,2017-02-07,20170223.0,,0000-00-00,,
8,14BGL063,一般项目,管理学,资源回收政策下闭环供应链定价及契约协调机制研究,2014-06-15,李新然,副高级,大连理工大学,211且985,辽宁,高等院校、其他学校,,,,,,,,,
9,14CGL018,青年项目,管理学,绩效反馈对新生代知识型员工反生产行为的影响机制与对策研究,2014-06-15,刘文彬,中级,电子科技大学,211且985,四川,高等院校、其他学校,,,,,,,,,
10,14BGL162,一般项目,管理学,文博资源转换利用的模式研究,2014-06-15,谢梅,正高级,电子科技大学,211且985,四川,高等院校、其他学校,,,,,,,,,
11,14CGL026,青年项目,管理学,农地权利市场化配置下家庭农场土地适度规模经营实现机制研究,2014-06-15,刘灵辉,中级,电子科技大学,211且985,四川,高等院校、其他学校,,,,,,,,,
12,14BGL190,一般项目,管理学,深化国企改革背景下的企业全面预算成熟度测评研究,2014-06-15,刘凌冰,副高级,东北财经大学,非985非211,辽宁,高等院校、其他学校,,,,,,,,,
13,14BGL201,一般项目,管理学,基于地方理论的旅游目的地体验品质驱动机制及优化路径研究,2014-06-15,龙江智,副高级,东北财经大学,非985非211,辽宁,高等院校、其他学校,,,,,,,,,
14,14CGL040,青年项目,管理学,供需失衡下我国食品安全的政府监管机制研究,2014-06-15,费威,中级,东北财经大学,,辽宁,高等院校、其他学校,供需失衡下我国食品安全的政府监管机制研究,研究报告,良好,2017-02-07,20170226.0,,0000-00-00,,
15,14BGL009,一般项目,管理学,基于社会网络分析的大学治理有效性研究,2014-06-15,姜华,副高级,东北大学,211且985,辽宁,高等院校、其他学校,,,,,,,,,
16,14CGL072,青年项目,管理学,消费者不安全感的形成机理与应对机制研究,2014-06-15,毕楠,副高级,东北师范大学,211非985,吉林,高等院校、其他学校,,,,,,,,,
17,14CGL075,青年项目,管理学,农村老年人过度劳动供给情境下的养老保障模式研究,2014-06-15,王文静,中级,东北师范大学,211非985,吉林,高等院校、其他学校,,,,,,,,,
18,14CGL068,青年项目,管理学,信用评级机构变更与信用等级迁移的动因及后果研究,2014-06-15,陈凌云,副高级,东华大学,211非985,上海,高等院校、其他学校,,,,,,,,,
19,14BGL132,一般项目,管理学,我国核电项目的社会稳定风险评估及协同治理机制研究,2014-06-15,罗志红,副高级,东华理工大学,非985非211,江西,高等院校、其他学校,,,,,,,,,
,项目批准号,项目类别,学科分类,项目名称,立项时间,项目负责人,专业职务,工作单位,单位类别,所在省区市,所属系统,成果名称,成果形式,成果等级,结项时间,结项证书号,出版社,出版时间,作者,获奖情况
0,14CGL012,青年项目,管理学,体验经济环境下商业生态系统和企业平台战略研究,2014-06-15,赵驰,中级,东南大学,211且985,江苏,高等院校、其他学校,,,,,,,,,
1,14BGL003,一般项目,管理学,创新驱动发展下中国科技人才战略的决策要素、路径选择与政策创新研究,2014-06-15,黄海刚,副高级,对外经济贸易大学,211非985,高校,高等院校、其他学校,,,,,,,,,
2,14BGL103,一般项目,管理学,我国城镇化进程中流动人口就业质量的评价与提升路径研究,2014-06-15,苏丽锋,副高级,对外经济贸易大学,211非985,高校,高等院校、其他学校,,,,,,,,,
3,14CGL002,青年项目,管理学,基于新实证产业组织理论的石油工业管制政策效果研究,2014-06-15,周末,中级,对外经济贸易大学,211非985,高校,高等院校、其他学校,,,,,,,,,
4,14BGL177,一般项目,管理学,中国企业海外投资税务筹划研究,2014-06-15,王素荣,正高级,对外经济贸易大学,211非985,高校,高等院校、其他学校,,,,,,,,,
5,14BGL178,一般项目,管理学,面向金字塔底层市场的包容性创新及政策研究,2014-06-15,邢小强,副高级,对外经济贸易大学,211非985,高校,高等院校、其他学校,,,,,,,,,
6,14BGL181,一般项目,管理学,我国高技术企业通过跨国技术战略联盟进行多维“跨边界”学习与风险防御机制研究,2014-06-15,杨震宁,副高级,对外经济贸易大学,211非985,高校,高等院校、其他学校,,,,,,,,,
7,14CGL067,青年项目,管理学,基金家族特质对基金投资行为及绩效影响研究,2014-06-15,王珏,中级,对外经济贸易大学,211非985,高校,高等院校、其他学校,,,,,,,,,
8,14AGL007,重点项目,管理学,国企红利征缴比例倍增目标下的国资预算支出民生化研究,2014-06-15,陈少晖,正高级,福建师范大学,非985非211,福建,高等院校、其他学校,,,,,,,,,
9,14BGL045,一般项目,管理学,风险管理导向的地方政府债务会计及预警机制研究,2014-06-15,潘琰,正高级,福州大学,211非985,福建,高等院校、其他学校,,,,,,,,,
10,14CGL010,青年项目,管理学,电子商务平台衍生的互联网金融模式及监管研究,2014-06-15,蔚赵春,正高级,复旦大学,211且985,上海,高等院校、其他学校,,,,,,,,,
11,14BGL202,一般项目,管理学,社交媒体驱动下中小城镇居民休闲行为、模式与空间的演变研究,2014-06-15,沈涵,副高级,复旦大学,211且985,上海,高等院校、其他学校,,,,,,,,,
12,14BGL194,一般项目,管理学,基于制度动机和市场转型理论视角的制度环境变迁与公司慈善行为研究,2014-06-15,唐跃军,副高级,复旦大学,211且985,上海,高等院校、其他学校,,,,,,,,,
13,14BGL057,一般项目,管理学,基于政府社会性规制的企业社会责任推进机制研究,2014-06-15,林军,正高级,甘肃政法学院,非985非211,甘肃,高等院校、其他学校,,,,,,,,,
14,14XGL006,西部项目,管理学,中央苏区卫生管理研究,2014-06-15,谭宗梅,正高级,赣南医学院,非985非211,江西,高等院校、其他学校,,,,,,,,,
15,14BGL187,一般项目,管理学,我国资本市场类群失谐及危机关系问题研究,2014-06-15,赵建群,中级,广东财经大学,非985非211,广东,高等院校、其他学校,,,,,,,,,
16,14BGL015,一般项目,管理学,新兴市场企业对外投资战略—IPM理论拓展与经验检验,2014-06-15,屈韬,正高级,广东财经大学,非985非211,广东,高等院校、其他学校,,,,,,,,,
17,14BGL032,一般项目,管理学,IPO泡沫治理视角下推进股票发行注册制的路径与风险控制研究,2014-06-15,陈见丽,正高级,广东金融学院,非985非211,广东,高等院校、其他学校,,,,,,,,,
18,14BGL134,一般项目,管理学,公共安全体系构建下的流动高危人口突发事件防控与处置研究,2014-06-15,马建文,正高级,广东警官学院,非985非211,广东,高等院校、其他学校,,,,,,,,,
19,14BGL076,一般项目,管理学,人力资源系统与员工幸福感研究,2014-06-15,张兴贵,正高级,广东外语外贸大学,非985非211,广东,高等院校、其他学校,,,,,,,,,
,项目批准号,项目类别,学科分类,项目名称,立项时间,项目负责人,专业职务,工作单位,单位类别,所在省区市,所属系统,成果名称,成果形式,成果等级,结项时间,结项证书号,出版社,出版时间,作者,获奖情况
0,14BGL079,一般项目,管理学,中国多元雇佣背景下的共同体型人力资源管理研究,2014-06-15,严标宾,副高级,广东外语外贸大学,非985非211,广东,高等院校、其他学校,,,,,,,,,
1,14BGL118,一般项目,管理学,卡尔多—希克斯效率视域下义务教育教师资源均衡配置研究,2014-06-15,吴小馨,正高级,广西大学,211非985,广西,高等院校、其他学校,,,,,,,,,
2,14BGL126,一般项目,管理学,基于学术职业视角的现代大学制度研究,2014-06-15,蒋馨岚,副高级,贵州财经大学,非985非211,贵州,高等院校、其他学校,,,,,,,,,
3,14BGL213,一般项目,管理学,青年男男性行为者艾滋病危险性行为与社会文化研究,2014-06-15,胡健,正高级,贵州财经大学,非985非211,贵州,高等院校、其他学校,,,,,,,,,
4,14CGL025,青年项目,管理学,西南贫困地区乡村旅游发展对农户生计模式变迁影响研究,2014-06-15,盖媛瑾,副高级,贵州师范学院,非985非211,贵州,高等院校、其他学校,,,,,,,,,
5,14AGL004,重点项目,管理学,区域创新系统中科研院所作用机理与管理政策研究,2014-06-15,李柏洲,正高级,哈尔滨工程大学,211非985,黑龙江,高等院校、其他学校,,,,,,,,,
6,14BGL007,一般项目,管理学,区域知识产权战略系统协同与产业升级研究,2014-06-15,陈伟,正高级,哈尔滨工程大学,211非985,黑龙江,高等院校、其他学校,,,,,,,,,
7,14BGL030,一般项目,管理学,我国多级政府债务风险协同预警机制研究,2014-06-15,赵谦,正高级,哈尔滨商业大学,非985非211,黑龙江,高等院校、其他学校,,,,,,,,,
8,14BGL101,一般项目,管理学,资源—环境约束下我国能源输出省生态安全风险识别机制与管控体系研究,2014-06-15,汤杰,副高级,哈尔滨商业大学,非985非211,黑龙江,高等院校、其他学校,,,,,,,,,
9,14BGL084,一般项目,管理学,海南旅游业发展中的政府与市场关系优化研究,2014-06-15,王红,副高级,海南大学,211非985,海南,高等院校、其他学校,,,,,,,,,
10,14BGL021,一般项目,管理学,基于集群和网络互补的企业技术创新影响机制研究,2014-06-15,王松,副高级,杭州电子科技大学,非985非211,浙江,高等院校、其他学校,,,,,,,,,
11,14CGL074,青年项目,管理学,燕山—太行山集中连片特困地区社区参与式旅游扶贫绩效综合评估模型及实证研究,2014-06-15,邢慧斌,副高级,河北大学,非985非211,河北,高等院校、其他学校,,,,,,,,,
12,14BGL078,一般项目,管理学,新生代农民工就业偏好视阈下的民营中小企业用工管理研究,2014-06-15,贾冀南,正高级,河北工程大学,非985非211,河北,高等院校、其他学校,,,,,,,,,
13,14BGL055,一般项目,管理学,全球价值链中企业网络权力形成机理、重构路径与“锁定效应”突破策略研究,2014-06-15,康凯,正高级,河北工业大学,211非985,河北,高等院校、其他学校,,,,,,,,,
14,14BGL192,一般项目,管理学,基于雇员揭发的上市公司会计舞弊揭示机制研究,2014-06-15,岳殿民,副高级,河北工业大学,211非985,河北,高等院校、其他学校,,,,,,,,,
15,14CGL021,青年项目,管理学,旅游共生体系统构建及协调演化研究,2014-06-15,孙振杰,中级,河北经贸大学,非985非211,河北,高等院校、其他学校,,,,,,,,,
16,14BGL066,一般项目,管理学,网络化背景下顾客互动共创服务价值机理研究,2014-06-15,杨志勇,副高级,河北经贸大学,非985非211,河北,高等院校、其他学校,,,,,,,,,
17,14CGL030,青年项目,管理学,多尺度耦合下水生态系统服务价值测度及政策路径选择研究,2014-06-15,刘钢,中级,河海大学,211非985,江苏,高等院校、其他学校,,,,,,,,,
18,14CGL020,青年项目,管理学,“营利性经营模式”背景下我国自然遗产地国家公园体制创建研究,2014-06-15,臧德霞,中级,河海大学,211非985,江苏,高等院校、其他学校,,,,,,,,,
19,14CGL015,青年项目,管理学,新市民文化消费行为、约束因素与引导措施研究,2014-06-15,李光明,中级,河海大学,211非985,江苏,高等院校、其他学校,,,,,,,,,
,项目批准号,项目类别,学科分类,项目名称,立项时间,项目负责人,专业职务,工作单位,单位类别,所在省区市,所属系统,成果名称,成果形式,成果等级,结项时间,结项证书号,出版社,出版时间,作者,获奖情况
0,14BGL061,一般项目,管理学,基于物流同盟理论的物流共同化实现路径研究,2014-06-15,李南,中级,河南财经政法大学,非985非211,河南,高等院校、其他学校,,,,,,,,,
1,14CGL027,青年项目,管理学,欠发达地区农民合作扶贫模式研究,2014-06-15,刘宇翔,副高级,河南财经政法大学,非985非211,河南,高等院校、其他学校,,,,,,,,,
2,14BGL153,一般项目,管理学,网上信用风险的群体演化机制与多维防控策略研究,2014-06-15,魏明侠,正高级,河南工业大学,非985非211,河南,高等院校、其他学校,,,,,,,,,
3,14BGL013,一般项目,管理学,我国畜禽产业绿色安全体系研究,2014-06-15,吴一平,正高级,河南农业大学,非985非211,河南,高等院校、其他学校,,,,,,,,,
4,14BGL093,一般项目,管理学,新时期农地流转农业补贴与主产区小麦生产行为及农业政策改革研究,2014-06-15,马恒运,正高级,河南农业大学,非985非211,河南,高等院校、其他学校,,,,,,,,,
5,14CGL005,青年项目,管理学,基于创新网络的天生国际化企业知识吸收能力演化机理与路径研究,2014-06-15,潘宏亮,副高级,河南师范大学,非985非211,河南,高等院校、其他学校,,,,,,,,,
6,14BGL090,一般项目,管理学,利益关系引导下的生态林业建设保障机制研究,2014-06-15,刘德权,正高级,黑龙江大学,非985非211,黑龙江,高等院校、其他学校,,,,,,,,,
7,14BGL071,一般项目,管理学,工作场所乐趣与心理投入的中介作用研究,2014-06-15,石冠峰,副高级,石河子大学,211非985,兵团,高等院校、其他学校,,,,,,,,,
8,14BGL040,一般项目,管理学,制度背景、社会责任履行与企业权益资本成本研究,2014-06-15,魏卉,副高级,石河子大学,211非985,兵团,高等院校、其他学校,,,,,,,,,
9,14BGL122,一般项目,管理学,我国特大城市土地市场效率与政府调控效果研究,2014-06-15,张杰,副高级,首都经济贸易大学,非985非211,北京,高等院校、其他学校,,,,,,,,,
10,14BGL056,一般项目,管理学,国有企业高管腐败行为治理研究,2014-06-15,范合君,副高级,首都经济贸易大学,非985非211,北京,高等院校、其他学校,,,,,,,,,
11,14BGL214,一般项目,管理学,深化公立医院改革情景下我国远程医疗管理模式研究,2014-06-15,佘镜怀,副高级,首都经济贸易大学,非985非211,北京,高等院校、其他学校,,,,,,,,,
12,14BGL023,一般项目,管理学,研发指数构建与应用评价研究,2014-06-15,崔也光,正高级,首都经济贸易大学,非985非211,北京,高等院校、其他学校,,,,,,,,,
13,14BGL189,一般项目,管理学,企业关系网络、输入型和内生型内部控制缺陷防扩散机制研究,2014-06-15,王海林,正高级,首都经济贸易大学,非985非211,北京,高等院校、其他学校,,,,,,,,,
14,14BGL143,一般项目,管理学,基于公共选择理论的社会资本举办医疗机构路径选择与评价研究,2014-06-15,孟开,副高级,首都医科大学,非985非211,北京,高等院校、其他学校,,,,,,,,,
15,14BGL215,一般项目,管理学,我国生命临终关怀模式的管理研究,2014-06-15,李义庭,正高级,首都医科大学,非985非211,北京,高等院校、其他学校,,,,,,,,,
16,14CGL038,青年项目,管理学,群体性事件政策议程学发生机制与治理研究,2014-06-15,李强彬,副高级,四川大学,211且985,四川,高等院校、其他学校,,,,,,,,,
17,14XGL003,西部项目,管理学,农产品食品安全视阈下的农业生产模式转型问题研究,2014-06-15,漆雁斌,正高级,四川农业大学,211非985,四川,高等院校、其他学校,,,,,,,,,
