,项目批准号,项目类别,学科分类,项目名称,立项时间,项目负责人,专业职务,工作单位,单位类别,所在省区市,所属系统,成果名称,成果形式,成果等级,结项时间,结项证书号,出版社,出版时间,作者,获奖情况
14,16AGL012,重点项目,管理学,利用互联网信息技术提升农产品流通效率研究,2016-06-30,吕建军,副高级,中国农业大学,985,高校,高等院校、其他学校,,,,,,,,,
15,16AGL013,重点项目,管理学,农民工回流视角下的农村养老保障研究,2016-06-30,李放,正高级,南京农业大学,非985,江苏,高等院校、其他学校,,,,,,,,,
16,16AGL014,重点项目,管理学,中国失能老人长期照护财务供给多元主体融合机制、模式与制度架构研究,2016-06-30,曹信邦,正高级,南京财经大学,非985,江苏,高等院校、其他学校,,,,,,,,,
17,16AGL015,重点项目,管理学,市场经济下公共服务供给中的公私部门角色关系定位研究,2016-06-30,顾建光,正高级,上海交通大学,985,上海,高等院校、其他学校,,,,,,,,,
18,16AGL016,重点项目,管理学,IAD框架下集中连片特困地区主动协商型扶贫开发模式研究,2016-06-30,段豫川,正高级,贵州大学,非985,贵州,高等院校、其他学校,,,,,,,,,
19,16AGL017,重点项目,管理学,面向大数据驱动的极端灾害性气象事件态势生成与可视化原型系统构建研究,2016-06-30,杨继君,副高级,中共广西区委党校,,广西,各级党校,,,,,,,,,
,项目批准号,项目类别,学科分类,项目名称,立项时间,项目负责人,专业职务,工作单位,单位类别,所在省区市,所属系统,成果名称,成果形式,成果等级,结项时间,结项证书号,出版社,出版时间,作者,获奖情况
0,16AGL018,重点项目,管理学,特重大自然灾害后恢复重建机制建设研究,2016-06-30,龚维斌,正高级,国家行政学院,,机关,各级党政机关,,,,,,,,,
1,16AGL019,重点项目,管理学,学校办学自主权边界及落实机制研究,2016-06-30,蒲蕊,正高级,武汉大学,985,湖北,高等院校、其他学校,,,,,,,,,
2,16AGL020,重点项目,管理学,我国区域知识资本报告及其应用研究,2016-06-30,董必荣,正高级,南京审计大学,非985,江苏,高等院校、其他学校,,,,,,,,,
3,16AGL021,重点项目,管理学,兵役制度比较与发展研究,2016-06-30,李建海,副高级,军事科学院,,军队,军队系统,,,,,,,,,
4,16AGL022,重点项目,管理学,加强我国军事能源体系建设研究,2016-06-30,童蕴河,副高级,军事科学院,,军队,军队系统,,,,,,,,,
5,16AGL023,重点项目,管理学,陆军无人化作战力量建设研究,2016-06-30,曾杨智,正高级,解放军理工大学,,军队,军队系统,,,,,,,,,
6,16AGL024,重点项目,管理学,习近平总书记关于军队建设和管理思想研究,2016-06-30,张松旭,副高级,信息工程大学,,军队,军队系统,,,,,,,,,
7,16BGL001,一般项目,管理学,支撑制造强国战略的新型制造体系构建及保障策略研究,2016-06-30,刘洪伟,副高级,天津大学,985,天津,高等院校、其他学校,,,,,,,,,
8,16BGL002,一般项目,管理学,“互联网＋”农产品订单质押融资模式创新及风险防范机制研究,2016-06-30,徐鹏,副高级,西南政法大学,非985,重庆,高等院校、其他学校,,,,,,,,,
9,16BGL003,一般项目,管理学,基于贝叶斯方法的社会网络大数据使用与隐私保护平衡机制研究,2016-06-30,李凤英,副高级,上海交通大学,985,上海,高等院校、其他学校,,,,,,,,,
10,16BGL004,一般项目,管理学,基于社会网络的企业社会责任与绿色治理的关系研究,2016-06-30,王建琼,正高级,西南交通大学,非985,四川,高等院校、其他学校,,,,,,,,,
11,16BGL005,一般项目,管理学,网路治理与网路组织创新机制研究,2016-06-30,齐羽,中级,浙江工商大学,非985,浙江,高等院校、其他学校,,,,,,,,,
12,16BGL006,一般项目,管理学,“一带一路”基础设施项目投资利益相关者分析及合作建设研究,2016-06-30,谭英双,副高级,重庆大学,985,重庆,高等院校、其他学校,,,,,,,,,
13,16BGL007,一般项目,管理学,碳排放视角下超大城市绿色低碳发展路径研究,2016-06-30,任继勤,副高级,北京化工大学,非985,高校,高等院校、其他学校,,,,,,,,,
14,16BGL008,一般项目,管理学,基于知识资本驱动的新型制造体系构建研究,2016-06-30,刘英基,副高级,河南师范大学,非985,河南,高等院校、其他学校,,,,,,,,,
15,16BGL009,一般项目,管理学,推进中医药服务贸易发展路径与策略研究,2016-06-30,侯胜田,正高级,北京中医药大学,非985,高校,高等院校、其他学校,,,,,,,,,
16,16BGL010,一般项目,管理学,我国产业政策对商业模式创新的作用机制研究,2016-06-30,李永发,副高级,安徽财经大学,非985,安徽,高等院校、其他学校,,,,,,,,,
17,16BGL011,一般项目,管理学,新规制经济学视角下电商扶贫及其商业模式创新研究,2016-06-30,颜锦江,副高级,四川大学,985,四川,高等院校、其他学校,,,,,,,,,
18,16BGL012,一般项目,管理学,中国零售业“走出去”对接“一带一路”国家战略的途径及对策研究,2016-06-30,朱瑞庭,正高级,上海建桥学院,非985,上海,高等院校、其他学校,,,,,,,,,
19,16BGL013,一般项目,管理学,中国水电工程技术标准“走出去”竞争模式、治理机制与对策研究,2016-06-30,唐震,正高级,河海大学,非985,江苏,高等院校、其他学校,,,,,,,,,
,项目批准号,项目类别,学科分类,项目名称,立项时间,项目负责人,专业职务,工作单位,单位类别,所在省区市,所属系统,成果名称,成果形式,成果等级,结项时间,结项证书号,出版社,出版时间,作者,获奖情况
0,16BGL014,一般项目,管理学,中国主导下的“一带一路”沿线国家物流网络的深度融合研究,2016-06-30,姚红光,副高级,上海工程技术大学,非985,上海,高等院校、其他学校,,,,,,,,,
1,16BGL015,一般项目,管理学,“互联网＋”背景下制造企业供给侧结构性改革路径研究,2016-06-30,李刚,副高级,西安邮电大学,非985,陕西,高等院校、其他学校,,,,,,,,,
2,16BGL016,一般项目,管理学,创新网络活跃度对产业集群升级影响研究,2016-06-30,赫连志巍,正高级,燕山大学,非985,河北,高等院校、其他学校,,,,,,,,,
3,16BGL017,一般项目,管理学,促进生物质利用及技术创新的政策激励机制研究,2016-06-30,钱艳俊,副高级,西北工业大学,985,陕西,高等院校、其他学校,,,,,,,,,
4,16BGL018,一般项目,管理学,劳动力成本上涨对我国制造业的影响研究,2016-06-30,黄顺春,正高级,江西理工大学,非985,江西,高等院校、其他学校,,,,,,,,,
5,16BGL019,一般项目,管理学,少数民族特色产品小微企业的发展模式与升级路径研究,2016-06-30,王瑞永,正高级,内蒙古财经大学,非985,内蒙,高等院校、其他学校,,,,,,,,,
6,16BGL020,一般项目,管理学,新常态下我国装备制造业海外并购风险异质性与预警机制研究,2016-06-30,宋维佳,正高级,东北财经大学,非985,辽宁,高等院校、其他学校,,,,,,,,,
7,16BGL021,一般项目,管理学,制造业转型升级的协同创新战略与实现机制研究,2016-06-30,柏丹,正高级,大连大学,非985,辽宁,高等院校、其他学校,,,,,,,,,
8,16BGL022,一般项目,管理学,中国制造业企业跨国并购后整合路径与战略互补机制研究,2016-06-30,范黎波,正高级,对外经济贸易大学,非985,高校,高等院校、其他学校,,,,,,,,,
9,16BGL023,一般项目,管理学,基于创业生态系统的众创空间运行机制与促进政策研究,2016-06-30,向武,正高级,成都信息工程大学,非985,四川,高等院校、其他学校,,,,,,,,,
10,16BGL024,一般项目,管理学,基于决策者行为的创业风险动态测度及预控机制研究,2016-06-30,李晓峰,正高级,四川大学,985,四川,高等院校、其他学校,,,,,,,,,
11,16BGL025,一般项目,管理学,基于领投跟投制的天使投资众筹联合投资网络研究,2016-06-30,李姚矿,正高级,合肥工业大学,非985,安徽,高等院校、其他学校,,,,,,,,,
12,16BGL026,一般项目,管理学,基于社会网络演化的创业投资风险缓解动态机制及多维策略研究,2016-06-30,杨艳萍,正高级,河南工业大学,非985,河南,高等院校、其他学校,,,,,,,,,
13,16BGL027,一般项目,管理学,创业团队成员隐性人力资本激励研究,2016-06-30,程江,中级,天津财经大学,非985,天津,高等院校、其他学校,,,,,,,,,
14,16BGL028,一般项目,管理学,自组织众创行为的形成、演化及促进策略研究,2016-06-30,蔡莉,副高级,江苏大学,非985,江苏,高等院校、其他学校,,,,,,,,,
15,16BGL029,一般项目,管理学,“区域医疗协同平台”协同效益提升机制研究,2016-06-30,游静,正高级,重庆科技学院,非985,重庆,高等院校、其他学校,,,,,,,,,
16,16BGL030,一般项目,管理学,基于“微笑曲线”视角的产业融合与制造业绿色转型升级路径研究,2016-06-30,付宏,副高级,湖北经济学院,非985,湖北,高等院校、其他学校,,,,,,,,,
17,16BGL031,一般项目,管理学,基于价值链创新的新型孵化器竞争力研究,2016-06-30,徐梦周,副高级,中共浙江省委党校,,浙江,各级党校,,,,,,,,,
18,16BGL032,一般项目,管理学,价值创造视角下互联网平台企业商业模式创新的影响因素与创新路径研究,2016-06-30,刘建刚,副高级,常州大学,非985,江苏,高等院校、其他学校,,,,,,,,,
19,16BGL033,一般项目,管理学,跨行政区域创新主体协同创新平台构建及运行机制研究,2016-06-30,吴和成,正高级,南京航空航天大学,非985,江苏,高等院校、其他学校,,,,,,,,,
,项目批准号,项目类别,学科分类,项目名称,立项时间,项目负责人,专业职务,工作单位,单位类别,所在省区市,所属系统,成果名称,成果形式,成果等级,结项时间,结项证书号,出版社,出版时间,作者,获奖情况
0,16BGL034,一般项目,管理学,嵌入视角下高校产学研用协同创新网络治理模式与机制研究,2016-06-30,赵彦志,正高级,东北财经大学,非985,辽宁,高等院校、其他学校,,,,,,,,,
1,16BGL035,一般项目,管理学,知识生态化视阈下创新生态系统演进范式与治理机制研究,2016-06-30,詹湘东,中级,湖南省社会科学院,,湖南,省、市社会科学院,,,,,,,,,
2,16BGL036,一般项目,管理学,技术创新与价值创新耦合视角的中国企业转型升级路径选择及其实现策略研究,2016-06-30,刘锦英,正高级,河南大学,非985,河南,高等院校、其他学校,,,,,,,,,
3,16BGL037,一般项目,管理学,社会资本、知识管理与科技型小微企业成长研究,2016-06-30,陶秋燕,正高级,北京联合大学,非985,北京,高等院校、其他学校,,,,,,,,,
4,16BGL038,一般项目,管理学,我国制造业企业创新驱动的国际标准化战略研究,2016-06-30,谢宗杰,副高级,重庆大学,985,重庆,高等院校、其他学校,,,,,,,,,
5,16BGL039,一般项目,管理学,工业互联网背景下企业技术创新路径演化研究,2016-06-30,魏国江,副高级,福建师范大学,非985,福建,高等院校、其他学校,,,,,,,,,
6,16BGL040,一般项目,管理学,技术集成能力对复杂装备性能的影响研究,2016-06-30,贺俊,副高级,中国社会科学院,,社科院,中国社会科学院,,,,,,,,,
7,16BGL041,一般项目,管理学,技术联盟组织间知识转移有效性的动态影响机制与提升路径研究,2016-06-30,张红兵,正高级,山西财经大学,非985,山西,高等院校、其他学校,,,,,,,,,
8,16BGL042,一般项目,管理学,新产品开发模糊前端阶段企业技术差异化能力的提升机理研究,2016-06-30,裴旭东,副高级,西安石油大学,非985,陕西,高等院校、其他学校,,,,,,,,,
9,16BGL043,一般项目,管理学,高端装备制造业企业持续创新实现研究,2016-06-30,杨栩,正高级,哈尔滨工程大学,非985,黑龙江,高等院校、其他学校,,,,,,,,,
10,16BGL044,一般项目,管理学,双重逻辑下新创企业的创新行为机制研究,2016-06-30,李宏贵,副高级,安徽财经大学,非985,安徽,高等院校、其他学校,,,,,,,,,
11,16BGL045,一般项目,管理学,中资银行跨境并购的绩效检验及路径选择研究,2016-06-30,刘瑞波,正高级,山东财经大学,非985,山东,高等院校、其他学校,,,,,,,,,
12,16BGL046,一般项目,管理学,公共服务购买模式与组织间管理控制的匹配性研究,2016-06-30,何晴,副高级,首都经济贸易大学,非985,北京,高等院校、其他学校,,,,,,,,,
13,16BGL047,一般项目,管理学,国企政策性负担、财务信息透明度与政府优惠资源配置效率,2016-06-30,叶松勤,副高级,江西师范大学,非985,江西,高等院校、其他学校,,,,,,,,,
14,16BGL048,一般项目,管理学,城市基础设施PPP项目融资风险与财政应对研究,2016-06-30,肖建华,正高级,江西财经大学,非985,江西,高等院校、其他学校,,,,,,,,,
15,16BGL049,一般项目,管理学,基于生态圈视角的P2P网络借贷信用风险传导、动态评测与防控策略研究,2016-06-30,谭中明,正高级,江苏大学,非985,江苏,高等院校、其他学校,,,,,,,,,
16,16BGL050,一般项目,管理学,资产误定价与系统性金融风险平滑性释放及动态监管研究,2016-06-30,张肖飞,副高级,河南财经政法大学,非985,河南,高等院校、其他学校,,,,,,,,,
17,16BGL051,一般项目,管理学,利率市场化背景下商业银行系统性风险诱发及传染机制研究,2016-06-30,吴成颂,正高级,安徽大学,非985,安徽,高等院校、其他学校,,,,,,,,,
18,16BGL052,一般项目,管理学,新常态初期区域金融风险生成机理及防控对策研究,2016-06-30,沈丽,正高级,山东财经大学,非985,山东,高等院校、其他学校,,,,,,,,,
19,16BGL053,一般项目,管理学,反倾销应诉的环境成本研究,2016-06-30,孙凤英,正高级,中南林业科技大学,非985,湖南,高等院校、其他学校,,,,,,,,,
,项目批准号,项目类别,学科分类,项目名称,立项时间,项目负责人,专业职务,工作单位,单位类别,所在省区市,所属系统,成果名称,成果形式,成果等级,结项时间,结项证书号,出版社,出版时间,作者,获奖情况
0,16BGL054,一般项目,管理学,“限薪令”对改进中央企业薪酬管理的效力评估及作用机理研究,2016-06-30,舒艳,副高级,西南财经大学,非985,四川,高等院校、其他学校,,,,,,,,,
1,16BGL055,一般项目,管理学,保险公司治理、投资效率与投保人利益保护研究,2016-06-30,郝臣,副高级,南开大学,985,天津,高等院校、其他学校,,,,,,,,,
2,16BGL056,一般项目,管理学,创新要素投资有效性评价及其与知识产权融资绩效的关系研究,2016-06-30,姚王信,副高级,安徽大学,非985,安徽,高等院校、其他学校,,,,,,,,,
3,16BGL057,一般项目,管理学,法律制度差异和文化距离对外资企业资本结构作用机制研究,2016-06-30,王进猛,副高级,南京审计大学,非985,江苏,高等院校、其他学校,,,,,,,,,
4,16BGL058,一般项目,管理学,国有企业混合所有制并购中的信任创新机制研究,2016-06-30,王艳,副高级,广东财经大学,非985,广东,高等院校、其他学校,,,,,,,,,
5,16BGL059,一般项目,管理学,货币政策对企业财务非对称性传导效应研究,2016-06-30,黎春,副高级,西南财经大学,非985,四川,高等院校、其他学校,,,,,,,,,
6,16BGL060,一般项目,管理学,基于有效性视角的中国高等院校财务资源配置研究,2016-06-30,冯宝军,正高级,大连理工大学,985,辽宁,高等院校、其他学校,,,,,,,,,
7,16BGL061,一般项目,管理学,新常态下劳动力成本上涨对微观企业产业转移的倒逼机制研究,2016-06-30,姚文韵,正高级,南京财经大学,非985,江苏,高等院校、其他学校,,,,,,,,,
8,16BGL062,一般项目,管理学,互联网配置交易模式下企业会计核算云端化问题研究,2016-06-30,丁胜红,中级,南京农业大学,非985,江苏,高等院校、其他学校,,,,,,,,,
9,16BGL063,一般项目,管理学,环境会计视角下的武陵山片区生态补偿会计核算体系构建研究,2016-06-30,周信君,中级,吉首大学,非985,湖南,高等院校、其他学校,,,,,,,,,
10,16BGL064,一般项目,管理学,碳权资产估值方法及其应用研究,2016-06-30,梁美健,正高级,首都经济贸易大学,非985,北京,高等院校、其他学校,,,,,,,,,
11,16BGL065,一般项目,管理学,研发费用所得税加计扣除政策对企业开发支出会计政策选择的影响及经济后果研究,2016-06-30,刘永涛,中级,首都经济贸易大学,非985,北京,高等院校、其他学校,,,,,,,,,
12,16BGL066,一般项目,管理学,股票操纵网络的演化机理与治理模式研究,2016-06-30,张建锋,中级,西安理工大学,非985,陕西,高等院校、其他学校,,,,,,,,,
13,16BGL067,一般项目,管理学,管理防御对企业选择性环境信息披露的影响及控制机制研究,2016-06-30,李强,副高级,中国矿业大学,非985,江苏,高等院校、其他学校,,,,,,,,,
14,16BGL068,一般项目,管理学,基于“业财融合”视角的先进制造业实时ABMS研究,2016-06-30,易颜新,正高级,杭州电子科技大学,非985,浙江,高等院校、其他学校,,,,,,,,,
15,16BGL069,一般项目,管理学,僵尸企业的僵化指数与市场退出机制研究,2016-06-30,栾甫贵,正高级,首都经济贸易大学,非985,北京,高等院校、其他学校,,,,,,,,,
16,16BGL070,一般项目,管理学,大数据下公允价值会计数据挖掘与智能决策的方法与运行机制研究,2016-06-30,郝玉贵,正高级,杭州电子科技大学,非985,浙江,高等院校、其他学校,,,,,,,,,
17,16BGL071,一般项目,管理学,供给侧改革中的价值分配财务与会计动力创新研究,2016-06-30,常华兵,副高级,南京财经大学,非985,江苏,高等院校、其他学校,,,,,,,,,
18,16BGL072,一般项目,管理学,自媒体时代“微平台”信息披露对资本市场流动性的影响研究,2016-06-30,徐静,中级,济南大学,非985,山东,高等院校、其他学校,,,,,,,,,
19,16BGL073,一般项目,管理学,国企“混改”中的职业经理人制度建构机制研究,2016-06-30,钱士茹,正高级,安徽大学,非985,安徽,高等院校、其他学校,,,,,,,,,
,项目批准号,项目类别,学科分类,项目名称,立项时间,项目负责人,专业职务,工作单位,单位类别,所在省区市,所属系统,成果名称,成果形式,成果等级,结项时间,结项证书号,出版社,出版时间,作者,获奖情况
0,16BGL074,一般项目,管理学,合法性约束下家族企业跨代成长研究,2016-06-30,吴炯,正高级,东华大学,非985,上海,高等院校、其他学校,,,,,,,,,
1,16BGL075,一般项目,管理学,“互联网＋”驱动的制造企业商业生态系统形成机制研究,2016-06-30,卢宝周,副高级,中国石油大学（华东）,非985,山东,高等院校、其他学校,,,,,,,,,
2,16BGL076,一般项目,管理学,基于利益相关者集体选择的中国双重股权结构研究,2016-06-30,杜媛,中级,中国海洋大学,985,山东,高等院校、其他学校,,,,,,,,,
3,16BGL077,一般项目,管理学,“一带一路”战略下新疆企业投资中亚市场进入方式选择研究,2016-06-30,王海芳,副高级,新疆财经大学,非985,新疆,高等院校、其他学校,,,,,,,,,
4,16BGL078,一般项目,管理学,所有者管理对家族企业公司治理的影响研究,2016-06-30,宋小保,正高级,汕头大学,非985,广东,高等院校、其他学校,,,,,,,,,
5,16BGL079,一般项目,管理学,需求不确定下企业绿色技术创新激励与政策效应研究,2016-06-30,申成霖,副高级,天津工业大学,非985,天津,高等院校、其他学校,,,,,,,,,
6,16BGL080,一般项目,管理学,供应链视角下服务转型制造企业的服务创新影响因素研究,2016-06-30,冯长利,副高级,大连理工大学,985,辽宁,高等院校、其他学校,,,,,,,,,
7,16BGL081,一般项目,管理学,新常态下绿色建筑供应链相关主体合作创新驱动要素与激励机制研究,2016-06-30,李明,副高级,江西财经大学,非985,江西,高等院校、其他学校,,,,,,,,,
8,16BGL082,一般项目,管理学,基于构型理论的可持续供应链治理模式与情景适配研究,2016-06-30,倪文斌,副高级,浙江财经大学,非985,浙江,高等院校、其他学校,,,,,,,,,
9,16BGL083,一般项目,管理学,基于区域整合与一体化战略的长江经济带内河港口泊位配比与运作优化研究,2016-06-30,李明琨,中级,上海大学,非985,上海,高等院校、其他学校,,,,,,,,,
10,16BGL084,一般项目,管理学,O2O背景下服务企业顾客间互动与价值共创研究,2016-06-30,蒋婷,中级,济南大学,非985,山东,高等院校、其他学校,,,,,,,,,
11,16BGL085,一般项目,管理学,基于CAS理论的品牌联盟组织间协作及其演化机制研究,2016-06-30,黄春萍,副高级,河北工业大学,非985,河北,高等院校、其他学校,,,,,,,,,
12,16BGL086,一般项目,管理学,快速迭代情境下创新产品扩散障碍识别与营销变革研究,2016-06-30,杨强,副高级,天津理工大学,非985,天津,高等院校、其他学校,,,,,,,,,
13,16BGL087,一般项目,管理学,基于大数据的消费者多参照点选择及其影响的研究,2016-06-30,汪平,中级,浙江师范大学,非985,浙江,高等院校、其他学校,,,,,,,,,
14,16BGL088,一般项目,管理学,基于领域本体的企业产品网络口碑危机预警研究,2016-06-30,何有世,正高级,江苏大学,非985,江苏,高等院校、其他学校,,,,,,,,,
15,16BGL089,一般项目,管理学,基于轻型评论与RFM双视角的重复购买用户识别研究,2016-06-30,程艳霞,正高级,武汉理工大学,非985,湖北,高等院校、其他学校,,,,,,,,,
16,16BGL090,一般项目,管理学,符号学视阈下中国传统文化元素的品牌呈现方式与传播策略研究,2016-06-30,陈立彬,副高级,北京工商大学,非985,北京,高等院校、其他学校,,,,,,,,,
17,16BGL091,一般项目,管理学,顾客语言认知视角下的企业家口碑对品牌形象的影响研究,2016-06-30,袁兵,中级,浙江师范大学,非985,浙江,高等院校、其他学校,,,,,,,,,
18,16BGL092,一般项目,管理学,企业社会响应视角下的管理者伦理敏感性研究,2016-06-30,郭志文,正高级,湖北大学,非985,湖北,高等院校、其他学校,,,,,,,,,
19,16BGL093,一般项目,管理学,“互联网＋”环境下乡村教师能力素质提升的机制创新研究,2016-06-30,罗江华,副高级,西南大学,非985,重庆,高等院校、其他学校,,,,,,,,,
,项目批准号,项目类别,学科分类,项目名称,立项时间,项目负责人,专业职务,工作单位,单位类别,所在省区市,所属系统,成果名称,成果形式,成果等级,结项时间,结项证书号,出版社,出版时间,作者,获奖情况
0,16BGL094,一般项目,管理学,高新技术产业集群产业链协同创新中的人力资本效率评价及提升路径研究,2016-06-30,张延平,副高级,广州大学,非985,广东,高等院校、其他学校,,,,,,,,,
1,16BGL095,一般项目,管理学,供给侧结构性改革背景下中国制造企业结构性和谐劳动关系研究,2016-06-30,李长江,正高级,浙江师范大学,非985,浙江,高等院校、其他学校,,,,,,,,,
2,16BGL096,一般项目,管理学,共享发展理念下企业员工薪酬的协调决策研究,2016-06-30,王庆,正高级,天津商业大学,非985,天津,高等院校、其他学校,,,,,,,,,
3,16BGL097,一般项目,管理学,我国健康人力资本的结构维度、测量体系及提升策略研究,2016-06-30,卿涛,正高级,西南财经大学,非985,四川,高等院校、其他学校,,,,,,,,,
4,16BGL098,一般项目,管理学,我国制造业转型升级与劳动力成本上涨的耦合研究,2016-06-30,刘毅,正高级,济南大学,非985,山东,高等院校、其他学校,,,,,,,,,
5,16BGL099,一般项目,管理学,新常态下兼顾雇佣双方利益的高绩效工作系统的结构及其作用机制研究,2016-06-30,苗仁涛,中级,首都经济贸易大学,非985,北京,高等院校、其他学校,,,,,,,,,
6,16BGL100,一般项目,管理学,转型中的工会实践对民营企业绩效的影响研究,2016-06-30,曹玲,副高级,南京信息工程大学,非985,江苏,高等院校、其他学校,,,,,,,,,
7,16BGL101,一般项目,管理学,“互联网＋”背景下知识型员工绩效薪酬偏好影响创新行为的机理研究,2016-06-30,李春玲,副高级,北京工商大学,非985,北京,高等院校、其他学校,,,,,,,,,
8,16BGL102,一般项目,管理学,基于工作系统模型的护士留职意愿与创新行为的影响机制及其干预策略实证研究,2016-06-30,章雅青,正高级,上海交通大学,985,上海,高等院校、其他学校,,,,,,,,,
9,16BGL103,一般项目,管理学,企业创新变革情境中的员工投入性工作资源管理研究,2016-06-30,胡俏,中级,浙江工业大学,非985,浙江,高等院校、其他学校,,,,,,,,,
10,16BGL104,一般项目,管理学,相互投资型雇佣关系下TMT对员工主动性行为的作用机理研究,2016-06-30,乔坤,副高级,大连理工大学,985,辽宁,高等院校、其他学校,,,,,,,,,
11,16BGL105,一般项目,管理学,新常态背景下TMT运作过程对战略决策绩效的影响机制研究,2016-06-30,刘喜怀,副高级,周口师范学院,非985,河南,高等院校、其他学校,,,,,,,,,
