,项目批准号,项目类别,学科分类,项目名称,立项时间,项目负责人,专业职务,工作单位,单位类别,所在省区市,所属系统,成果名称,成果形式,成果等级,结项时间,结项证书号,出版社,出版时间,作者,获奖情况
5,12CGL022,青年项目,管理学,社会资本与民间借贷风险控制研究,2012-05-14,林丽琼,副高级,福建农林大学经济与管理学院,,福建,高等院校、其他学校,,,,,,,,,
6,12CGL023,青年项目,管理学,审慎监管程度对金融风险控制与效率的影响机理研究,2012-05-14,曾薇,中级,湖南大学工商管理学院,985大学、211大学,湖南,高等院校、其他学校,,,,,,,,,
7,12CGL024,青年项目,管理学,我国基层政府财政透明度实现的路径与策略研究,2012-05-14,申亮,副高级,山东财经大学（筹）,,山东,高等院校、其他学校,我国基层政府财政透明度实现的路径与策略研究,专著,良好,2015-06-15,20150801.0,,0000-00-00,,
8,12CGL025,青年项目,管理学,管理层权力、信息披露质量与投资效率的实证研究,2012-05-14,徐良果,中级,西藏大学财经学院,211大学,西藏,高等院校、其他学校,管理层权力、信息披露质量与投资效率的实证研究,论文集,合格,2015-04-23,20150547.0,,0000-00-00,,
9,12CGL026,青年项目,管理学,治理转型视角的国有企业非效率投资的战略性管控机制研究,2012-05-14,刘媛媛,副高级,东北财经大学会计学院,,辽宁,高等院校、其他学校,,,,,,,,,
10,12CGL027,青年项目,管理学,转轨经济背景下的媒体治理与投资者保护的理论与实证研究,2012-05-14,张娆,中级,东北财经大学会计学院,,辽宁,高等院校、其他学校,转轨经济背景下的媒体治理与投资者保护：理论与实证研究,研究报告,良好,2017-03-01,20170455.0,,0000-00-00,,省级二等奖
11,12CGL028,青年项目,管理学,公允价值会计的风险相关性研究,2012-05-14,徐先知,中级,长沙理工大学经济与管理学院,,湖南,高等院校、其他学校,,,,,,,,,
12,12CGL029,青年项目,管理学,国际环境下会计准则新进展对金融监管的影响及协调研究,2012-05-14,王守海,副高级,山东财经大学（筹）,,山东,高等院校、其他学校,国际环境下会计准则新进展对金融监管的影响及协调研究,研究报告,良好,2017-05-18,20170830.0,,0000-00-00,,
13,12CGL030,青年项目,管理学,融资决策、资本结构调整与经理管理防御研究,2012-05-14,张海龙,中级,天水师范学院社会经济与管理学院,,甘肃,高等院校、其他学校,,,,,,,,,
14,12CGL031,青年项目,管理学,海洋装备制造企业战略转型路径和机制研究,2012-05-14,贾晓霞,副高级,上海海事大学,,上海,高等院校、其他学校,,,,,,,,,
15,12CGL032,青年项目,管理学,家族企业传承的动因与经济后果研究,2012-05-14,李思飞,中级,北京外国语大学国际商学院,211大学,教育部,高等院校、其他学校,,,,,,,,,
16,12CGL033,青年项目,管理学,企业战略转型模式与实施路径的匹配关系研究,2012-05-14,周杰,中级,南开大学泰达学院,985大学、211大学,天津,高等院校、其他学校,,,,,,,,,
17,12CGL034,青年项目,管理学,机会不平等下的家族企业成长与治理优化研究,2012-05-14,石水平,副高级,暨南大学管理学院会计学系,211大学,广东,高等院校、其他学校,,,,,,,,,
18,12CGL035,青年项目,管理学,媒体正面报道与公司治理研究,2012-05-14,醋卫华,中级,湘潭大学商学院,,湖南,高等院校、其他学校,,,,,,,,,
19,12CGL036,青年项目,管理学,物流协同能力的作用机理及其模型构建研究,2012-05-14,王晓玉,中级,华南理工大学工商管理学院,985大学、211大学,广东,高等院校、其他学校,,,,,,,,,
,项目批准号,项目类别,学科分类,项目名称,立项时间,项目负责人,专业职务,工作单位,单位类别,所在省区市,所属系统,成果名称,成果形式,成果等级,结项时间,结项证书号,出版社,出版时间,作者,获奖情况
0,12CGL037,青年项目,管理学,政府干预亲周期特征、企业投资协同行为与经营绩效研究,2012-05-14,赵懿清,中级,首都经济贸易大学会计学院,,北京,高等院校、其他学校,,,,,,,,,
1,12CGL038,青年项目,管理学,立体间性视野下企业社会责任文化及认同研究,2012-05-14,颜冰,副高级,东北石油大学,,黑龙江,高等院校、其他学校,,,,,,,,,
2,12CGL039,青年项目,管理学,中国企业社会责任评价与推进机制研究,2012-05-14,肖红军,中级,中国社会科学院工业经济研究所,,社科院,中国社会科学院,,,,,,,,,
3,12CGL040,青年项目,管理学,基于PBC的企业服务备件供应链优化决策研究,2012-05-14,戴勇,中级,华东师范大学,985大学、211大学,上海,高等院校、其他学校,,,,,,,,,
4,12CGL041,青年项目,管理学,基于多渠道选择和产品引入的多供应链运作优化决策研究,2012-05-14,曹宗宏,副高级,安徽农业大学,,安徽,高等院校、其他学校,基于多渠道选择和产品引入的供应链协调优化策略研究,专著论文集,良好,2015-07-31,20150966.0,,0000-00-00,,
5,12CGL042,青年项目,管理学,基于供应商产能的供应应急策略与设计研究,2012-05-14,李新军,副高级,烟台大学经济与工商管理学院,,山东,高等院校、其他学校,,,,,,,,,
6,12CGL043,青年项目,管理学,供应商能力营销的方式选择与作用机理研究,2012-05-14,刘石兰,副高级,广东外语外贸大学,,广东,高等院校、其他学校,,,,,,,,,
7,12CGL044,青年项目,管理学,老字号品牌真实性、作用机理及其营销策略研究,2012-05-14,徐伟,中级,安徽财经大学工商管理学院,,安徽,高等院校、其他学校,,,,,,,,,
8,12CGL045,青年项目,管理学,双渠道下高残值易逝品生产-分销网络优化策略研究,2012-05-14,阳成虎,副高级,福州大学八方物流学院,211大学,福建,高等院校、其他学校,双渠道下高残值易逝品生产—分销网络优化策略研究,研究报告,良好,2015-05-28,20150621.0,,0000-00-00,,
9,12CGL046,青年项目,管理学,基于质量安全视角的农产品顾客感知价值形成机制实证研究,2012-05-14,张国政,副高级,湖南农业大学商学院,,湖南,高等院校、其他学校,,,,,,,,,
10,12CGL047,青年项目,管理学,模糊情境下产品危机认知机制研究,2012-05-14,王志良,中级,上海大学管理学院,211大学,上海,高等院校、其他学校,,,,,,,,,
11,12CGL048,青年项目,管理学,网购消费者后悔情绪的成因、影响及其管理策略研究,2012-05-14,张初兵,中级,天津财经大学商学院,,天津,高等院校、其他学校,,,,0000-00-00,,,0000-00-00,,
12,12CGL049,青年项目,管理学,差错管理气氛对企业创新行为的影响机理及对策研究,2012-05-14,李忆,副高级,重庆邮电大学,,重庆,高等院校、其他学校,,,,,,,,,
13,12CGL050,青年项目,管理学,自我管理团队的团队学习与团队创新研究,2012-05-14,吴铁钧,中级,苏州大学教育学院,211大学,江苏,高等院校、其他学校,,,,,,,,,
14,12CGL051,青年项目,管理学,新移民知识员工流动的成因、路径与内在机理研究,2012-05-14,黎春燕,中级,海南大学经济与管理学院,211大学,海南,高等院校、其他学校,,,,,,,,,
15,12CGL052,青年项目,管理学,基于社会网络嵌入视角的人力资源实践包对组织效能影响的多层研究,2012-05-14,张光磊,中级,华南理工大学工商管理学院,985大学、211大学,广东,高等院校、其他学校,,,,,,,,,
16,12CGL053,青年项目,管理学,中国公司跨国经营中人力资源管理问题研究,2012-05-14,金家飞,副高级,西南财经大学工商管理学院,211大学,四川,高等院校、其他学校,,,,,,,,,
17,12CGL054,青年项目,管理学,组织支持契合、雇佣关系稳定与新生代农民工治理研究,2012-05-14,淦未宇,中级,西南政法大学管理学院,,重庆,高等院校、其他学校,,,,,,,,,
18,12CGL055,青年项目,管理学,文化科技复合型创新团队胜任力模型及动态开发机制研究,2012-05-14,张廷君,中级,福建师范大学公共管理学院,,福建,高等院校、其他学校,,,,,,,,,
19,12CGL056,青年项目,管理学,中西方文化差异视角下领导-部属关系结构模型及影响机制研究,2012-05-14,任真,中级,中国浦东干部学院,,上海,各级党校,,,,,,,,,
,项目批准号,项目类别,学科分类,项目名称,立项时间,项目负责人,专业职务,工作单位,单位类别,所在省区市,所属系统,成果名称,成果形式,成果等级,结项时间,结项证书号,出版社,出版时间,作者,获奖情况
0,12CGL057,青年项目,管理学,大型节事举办后中国旅游形象演变机理及和谐发展战略研究,2012-05-14,陈楠,副高级,河南大学,,河南,高等院校、其他学校,,,,,,,,,
1,12CGL058,青年项目,管理学,我国文化创意旅游产业发展模式与对策研究,2012-05-14,王欣,副高级,北京第二外国语学院,,北京,高等院校、其他学校,,,,,,,,,
2,12CGL059,青年项目,管理学,中国沿海地区旅游产业结构与旅游产业集聚关联机理研究,2012-05-14,刘佳,中级,中国海洋大学管理学院,211大学、985大学,山东,高等院校、其他学校,中国沿海地区旅游产业结构与旅游产业集聚关联机理研究,研究报告,优秀,2016-12-15,20162025.0,,0000-00-00,,
3,12CGL060,青年项目,管理学,两岸四地旅游应急合作体系建设研究,2012-05-14,谢朝武,副高级,华侨大学旅游学院,,福建,高等院校、其他学校,,,,,,,,,
4,12CGL061,青年项目,管理学,移动用户生成内容环境下旅游者信息行为分析与我国旅游营销模式创新研究,2012-05-14,彭润华,副高级,广西师范大学经济管理学院,,广西,高等院校、其他学校,,,,,,,,,
5,12CGL062,青年项目,管理学,基于农户技术选择视角的农业面源污染控制政策设计,2012-05-14,金书秦,中级,农业部农村经济研究中心,,党校,各级党政机关,基于农户技术选择视角的农业面源污染控制政策设计,专著,,2015-10-26,20151424.0,,0000-00-00,,
6,12CGL063,青年项目,管理学,农民合作经济组织和农业社会化服务供给模式创新研究,2012-05-14,杨丹,中级,西南大学经济管理学院,211大学,重庆,高等院校、其他学校,农民合作经济组织在农业社会化服务中的作用研究,研究报告,良好,2015-07-20,20151031.0,,0000-00-00,,
7,12CGL064,青年项目,管理学,我国种业对外开放的适度性评估与政策选择,2012-05-14,陈龙江,副高级,华南农业大学,,广东,高等院校、其他学校,,,,,,,,,
8,12CGL065,青年项目,管理学,征地过程中的经济补偿测算及失地农民权益保障机制研究,2012-05-14,张志,中级,中国地质大学（武汉）,211大学,湖北,高等院校、其他学校,,,,,,,,,
9,12CGL066,青年项目,管理学,基于低碳视角的农户农地利用行为研究,2012-05-14,郑晶,中级,福建农林大学人文社会科学学院,,福建,高等院校、其他学校,,,,,,,,,
10,12CGL067,青年项目,管理学,农产品流通渠道变革及其福利效应研究,2012-05-14,赵晓飞,中级,湖北大学,,湖北,高等院校、其他学校,农产品流通渠道变革及其经济效应研究（研究报告）,论文研报,,2017-07-13,20171105.0,,0000-00-00,,阶段性成果获全国商务发展研究成果奖二等奖、湖北省第九届社科优秀成果三等奖
11,12CGL068,青年项目,管理学,我国水资源反退化适应性管理模式研究,2012-05-14,周申蓓,中级,河海大学商学院,211大学,江苏,高等院校、其他学校,,,,,,,,,
12,12CGL069,青年项目,管理学,低碳经济背景下企业节能减排行为分析与优化管理研究,2012-05-14,石磊,中级,中国人民大学,985大学、211大学,教育部,高等院校、其他学校,,,,,,,,,
13,12CGL070,青年项目,管理学,基于适应性管理的流域水污染多主体合作生态补偿机制研究,2012-05-14,张婕,中级,河海大学商学院,211大学,江苏,高等院校、其他学校,,,,,,,,,
14,12CGL071,青年项目,管理学,我国农村生活垃圾管理模式与政策研究,2012-05-14,梁蒙,中级,河南大学,,河南,高等院校、其他学校,,,,,,,,,
15,12CGL072,青年项目,管理学,海峡两岸民营企业劳动关系民主化管理比较研究,2012-05-14,郑文智,中级,华侨大学工商管理学院,,福建,高等院校、其他学校,,,,,,,,,
16,12CGL073,青年项目,管理学,基于扩大内需战略的新生代农民工市民化路径研究,2012-05-14,倪建伟,中级,中国（海南）改革发展研究院,,海南,其他,基于扩大内需战略的新生代农民工市民化路径研究,研究报告,,2014-05-05,20140713.0,,0000-00-00,,
17,12CGL074,青年项目,管理学,我国城镇化进程中失地农户劳动供给决策与就业发展研究,2012-05-14,陈浩,副高级,江苏大学管理学院,,江苏,高等院校、其他学校,,,,,,,,,
18,12CGL075,青年项目,管理学,新生代农民工城市融入的进程测度及政策创新研究,2012-05-14,许光,副高级,中共浙江省委党校,,浙江,各级党校,,,,,,,,,
19,12CGL076,青年项目,管理学,社会养老服务体系的产业支持研究,2012-05-14,钟春洋,副高级,中共宁波市委党校,,浙江,各级党校,,,,,,,,,
,项目批准号,项目类别,学科分类,项目名称,立项时间,项目负责人,专业职务,工作单位,单位类别,所在省区市,所属系统,成果名称,成果形式,成果等级,结项时间,结项证书号,出版社,出版时间,作者,获奖情况
0,12CGL077,青年项目,管理学,文化事业单位改制中社会保障政策衔接和配套改革研究,2012-05-14,孙守纪,中级,对外经济贸易大学保险学院,211大学,教育部,高等院校、其他学校,,,,,,,,,
1,12CGL078,青年项目,管理学,新型农村社会养老保险风险识别与防范研究,2012-05-14,何晖,中级,湘潭大学公共管理学院,,湖南,高等院校、其他学校,,,,,,,,,
2,12CGL079,青年项目,管理学,公共服务市场化实践中的公共性流失问题研究,2012-05-14,梅锦萍,中级,南京晓庄学院经济管理学院,,江苏,高等院校、其他学校,,,,,,,,,
3,12CGL080,青年项目,管理学,邻避冲突及其治理模式研究,2012-05-14,陈宝胜,中级,温州大学,,浙江,高等院校、其他学校,邻避冲突及其治理模式研究,专著,良好,2017-05-27,20170886.0,,0000-00-00,,
4,12CGL081,青年项目,管理学,基于包容性发展的我国都市圈地方政府整体性协作治理机制研究,2012-05-14,崔晶,副高级,中央财经大学,211大学,教育部,高等院校、其他学校,,,,,,,,,
5,12CGL082,青年项目,管理学,领导行为与政府绩效:基于中国县级政府的实证研究,2012-05-14,马佳铮,中级,中共上海市委党校,,上海,各级党校,,,,,,,,,
6,12CGL083,青年项目,管理学,民族地区基层政府社会管理模式创新比较研究,2012-05-14,胡佳,,广西民族大学管理学院,,广西,高等院校、其他学校,,,,,,,,,
7,12CGL084,青年项目,管理学,社会管理复杂性视角下乡镇政府组织结构变革研究,2012-05-14,曾维和,中级,南京信息工程大学公共管理学院,,江苏,高等院校、其他学校,,,,,,,,,
8,12CGL085,青年项目,管理学,我国省级政府权力空间配置制度研究,2012-05-14,赵国钦,中级,北京师范大学管理学院,985大学、211大学,教育部,高等院校、其他学校,,,,,,,,,
9,12CGL086,青年项目,管理学,当代中国公共决策咨询程序与机制的探索研究,2012-05-14,傅雨飞,,华中师范大学,211大学,湖北,高等院校、其他学校,,,,,,,,,
10,12CGL087,青年项目,管理学,互联网环境下的政策议程设置研究,2012-05-14,曾润喜,中级,华中科技大学,985大学、211大学,湖北,高等院校、其他学校,,,,,,,,,
11,12CGL088,青年项目,管理学,我国反补贴政策产业救济效果评估体系与方法研究,2012-05-14,乔小勇,中级,清华大学公共管理学院,985大学、211大学,教育部,高等院校、其他学校,,,,,,,,,
12,12CGL089,青年项目,管理学,协作知识建构视角下虚拟社会管理创新研究,2012-05-14,张会平,副高级,电子科技大学政治与公共管理学院,211大学、985大学,四川,高等院校、其他学校,协作知识建构视角下虚拟社会管理创新研究,研究报告,良好,2015-08-31,20151190.0,,0000-00-00,,
13,12CGL090,青年项目,管理学,完善中国特色现代大学制度研究,2012-05-14,谢凌凌,中级,广西财经学院管理科学与工程学院,,广西,高等院校、其他学校,,,,,,,,,
14,12CGL091,青年项目,管理学,我国高校贫困生家庭识别预警与分层救助研究,2012-05-14,毕鹤霞,中级,华东交通大学人文社会科学学院,,江西,高等院校、其他学校,,,,,,,,,
15,12CGL092,青年项目,管理学,保障房建设的社会空间效应、形成机制与福利测度研究,2012-05-14,李梦玄,副高级,中南财经政法大学,211大学,湖北,高等院校、其他学校,,,,,,,,,
16,12CGL093,青年项目,管理学,建立多元化保障性住房供应体系研究,2012-05-14,李恩平,副高级,中国社会科学院城市发展与环境研究所,,社科院,中国社会科学院,建立和完善多元化保障性住房供应体系研究——快速城镇化进程中居住弱势人群的视角,专著,良好,2017-03-14,20170430.0,,0000-00-00,,
17,12CGL094,青年项目,管理学,我国保障性住房市场板块化设计与动态管理研究,2012-05-14,张远索,副高级,北京联合大学应用文理学院,,北京,高等院校、其他学校,,,,,,,,,
18,12CGL095,青年项目,管理学,“乡-城”移民视野下新生代农民工城市融入的社区支持研究,2012-05-14,郎晓波,中级,中共杭州市委党校,,浙江,各级党校,,,,,,,,,
19,12CGL096,青年项目,管理学,社会工作介入与农民工新型社会管理体制建构研究,2012-05-14,刘艳文,中级,湖南省社会科学院社会学法学研究所,,湖南,省、市社会科学院,,,,,,,,,
,项目批准号,项目类别,学科分类,项目名称,立项时间,项目负责人,专业职务,工作单位,单位类别,所在省区市,所属系统,成果名称,成果形式,成果等级,结项时间,结项证书号,出版社,出版时间,作者,获奖情况
0,12CGL097,青年项目,管理学,社会管理创新与农村征地冲突治理研究,2012-05-14,祝天智,副高级,徐州师范大学管理学院,,江苏,高等院校、其他学校,,,,,,,,,
1,12CGL098,青年项目,管理学,社区小商贩社会管理创新研究,2012-05-14,周昕,中级,中共武汉市委党校,,湖北,各级党校,,,,,,,,,
2,12CGL099,青年项目,管理学,城市公共安全的合作网络治理研究,2012-05-14,李礼,中级,中共湖南省委党校,,湖南,各级党校,,,,,,,,,
3,12CGL100,青年项目,管理学,基于可追溯体系的食品安全全程监管机制与支持政策研究,2012-05-14,徐玲玲,副高级,江南大学江苏省食品安全研究基地,211大学,江苏,高等院校、其他学校,,,,,,,,,
4,12CGL101,青年项目,管理学,煤矿动态安全预警与关联管理问题研究,2012-05-14,王菲,副高级,华北水利水电学院,,河南,高等院校、其他学校,,,,,,,,,
5,12CGL102,青年项目,管理学,我国城市化进程中的邻避危机及对策研究,2012-05-14,吴涛,中级,中国浦东干部学院,,上海,各级党校,我国城市化进程中的邻避危机及对策研究,研报,合格,2017-06-23,20170923.0,,0000-00-00,,
6,12CGL103,青年项目,管理学,成都城乡居民基本医疗保险政策分析评估研究,2012-05-14,刘世勇,副高级,西南财经大学经济与管理研究院,211大学,四川,高等院校、其他学校,,,,,,,,,
7,12CGL104,青年项目,管理学,基于健康管理理念的社区慢性病防控合作模式研究,2012-05-14,李星明,中级,首都医科大学,,北京,高等院校、其他学校,,,,,,,,,
8,12CGL105,青年项目,管理学,我国公立医院的改革成本及其分担机制优化研究,2012-05-14,代志明,副高级,郑州轻工业学院,,河南,高等院校、其他学校,,,,,,,,,
9,12CGL106,青年项目,管理学,乡村医生身份认定及其相关保障研究,2012-05-14,金建强,中级,华中科技大学,985大学、211大学,湖北,高等院校、其他学校,,,,,,,,,
10,12CGL107,青年项目,管理学,公共服务横向援助模式和机制研究,2012-05-14,王达梅,副高级,广东外语外贸大学,,广东,高等院校、其他学校,公共服务横向援助满意模式与机制改进研究,专著,良好,2015-08-27,20151179.0,,0000-00-00,,
11,12CGL108,青年项目,管理学,区域基本公共服务均等化的财政体制效应研究,2012-05-14,田发,副高级,上海理工大学,,上海,高等院校、其他学校,,,,,,,,,
12,12CGL109,青年项目,管理学,东、中、西部义务教育均等化调查研究,2012-05-14,李军超,中级,华中师范大学,211大学,湖北,高等院校、其他学校,,,,,,,,,
13,12CGL110,青年项目,管理学,农村公益校车服务的地方政府供给研究,2012-05-14,董少林,副高级,安徽工业大学文法学院,,安徽,高等院校、其他学校,,,,,,,,,
14,12CGL111,青年项目,管理学,顾客满意视角的电子商务服务质量研究,2012-05-14,李海英,中级,中共广西壮族自治区委员会党校,,广西,各级党校,,,,,,,,,
15,12CGL112,青年项目,管理学,信息系统对服务型制造网络中商务关系的影响研究,2012-05-14,张志颖,副高级,河北工业大学,211大学,河北,高等院校、其他学校,,,,,,,,,
16,12CGL113,青年项目,管理学,公共资源网络治理研究,2012-05-14,唐兵,中级,南昌大学公共管理学院公共管理学系,211大学,江西,高等院校、其他学校,,,,,,,,,
17,12CGL114,青年项目,管理学,跨区域创意产业集群协同创新网络运作机制和政策研究,2012-05-14,毛磊,中级,江苏科技大学公共管理学院,,江苏,高等院校、其他学校,,,,,,,,,
18,12CGL115,青年项目,管理学,嵌入新国际分工网络体系的集群企业契约关系及治理对策研究,2012-05-14,易秋平,中级,湖南科技大学,,湖南,高等院校、其他学校,,,,,,,,,
19,12CGL116,青年项目,管理学,文化生态下闽台传统聚落保护与互动发展机制研究,2012-05-14,张杰,副高级,华东理工大学,211大学,上海,高等院校、其他学校,文化生态下闽台传统聚落保护与互动发展机制研究,专著,良好,2017-07-01,20171068.0,,0000-00-00,,
,项目批准号,项目类别,学科分类,项目名称,立项时间,项目负责人,专业职务,工作单位,单位类别,所在省区市,所属系统,成果名称,成果形式,成果等级,结项时间,结项证书号,出版社,出版时间,作者,获奖情况
0,12CGL117,青年项目,管理学,中部地区承接产业转移中基于环境伦理的政府政策转型研究,2012-05-14,汤明,副高级,九江学院,,江西,高等院校、其他学校,中部地区承接产业转移中基于环境伦理的政府政策转型研究,研究报告,合格,2017-03-14,20170523.0,,0000-00-00,,省社科优秀成果三等奖1
1,12CGL118,青年项目,管理学,城乡结合部规划建设模式与土地利用协调机制研究,2012-05-14,李强,中级,首都经济贸易大学,,北京,高等院校、其他学校,,,,,,,,,
2,12CGL119,青年项目,管理学,特大城市公交巴士企业补贴机制与测算方法研究,2012-05-14,卢宇,中级,首都经济贸易大学工商管理学院,,北京,高等院校、其他学校,,,,,,,,,
3,12CGL120,青年项目,管理学,中国快速城市化进程中的城市水安全战略研究,2012-05-14,许英明,中级,北京大学政府管理学院,985大学、211大学,教育部,高等院校、其他学校,,,,,,,,,
4,12CGL121,青年项目,管理学,我国非营利组织信息披露及其治理机制研究,2012-05-14,程博,副高级,浙江农林大学,,浙江,高等院校、其他学校,,,,,,,,,
5,12CGL122,青年项目,管理学,政府购买服务背景下社会工作服务机构发展研究,2012-05-14,谢敏,中级,桂林理工大学,,广西,高等院校、其他学校,,,,,,,,,
6,12CGL123,青年项目,管理学,中国非营利组织的治理和规制问题研究,2012-05-14,卢宪英,中级,中国社会科学院农村发展研究所,,社科院,中国社会科学院,,,,,,,,,
7,12CGL124,青年项目,管理学,财产权利视角下的我国城镇建筑遗产保护机制研究,2012-05-14,王红军,中级,同济大学建筑与城市规划学院,985大学、211大学,上海,高等院校、其他学校,,,,,,,,,
8,12CGL125,青年项目,管理学,我国世界文化遗产地可持续发展模式与评估体系研究,2012-05-14,张国超,中级,武汉工业学院,,湖北,高等院校、其他学校,,,,,,,,,
9,12BGL035,一般项目,管理学,会计控制与反倾销应诉研究,2012-05-14,孙凤英,正高级,中南林业科技大学,,湖南,高等院校、其他学校,,,,0000-00-00,,,0000-00-00,,
10,12BGL072,一般项目,管理学,旅游和旅游业的本体论研究,2012-05-14,王德刚,正高级,山东大学管理学院,211大学、985大学,山东,高等院校、其他学校,,,,0000-00-00,,,0000-00-00,,
11,12BGL072,一般项目,管理学,旅游和旅游业的本体论研究,2012-05-14,王德刚,正高级,山东大学管理学院,211大学、985大学,山东,高等院校、其他学校,,,,0000-00-00,,,0000-00-00,,
12,12BGL111,一般项目,管理学,基于信息技术的社区卫生服务绩效管理模式与实证研究,2012-05-14,胡红濮,副高级,中国医学科学院医学信息研究所,,0,高等院校、其他学校,,,,0000-00-00,,,0000-00-00,,
