,项目批准号,项目类别,学科分类,项目名称,立项时间,项目负责人,专业职务,工作单位,单位类别,所在省区市,所属系统,成果名称,成果形式,成果等级,结项时间,结项证书号,出版社,出版时间,作者,获奖情况
0,18AGL001,重点项目,管理学,共享经济下道德风险控制与信任机制构建研究,2018-06-21,石岿然,正高级,南京审计大学,,江苏,高等院校、其他学校,,,,,,,,,
1,18AGL002,重点项目,管理学,中国战略性矿产资源国家安全评估与预警系统研究（2020—2050）,2018-06-21,郑明贵,正高级,江西理工大学,,江西,高等院校、其他学校,,,,,,,,,
2,18AGL003,重点项目,管理学,基于市场导向的中国制造业动态绿色政府补贴机制研究,2018-06-21,李怡娜,正高级,华南理工大学,985高校211高校,广东,高等院校、其他学校,,,,,,,,,
3,18AGL004,重点项目,管理学,全球华侨华人网络对中国跨国企业子公司生存与国际竞争新优势影响研究,2018-06-21,衣长军,正高级,华侨大学,,福建,高等院校、其他学校,,,,,,,,,
4,18AGL005,重点项目,管理学,基于伙伴竞合关系的标准联盟企业知识管理策略选择机制研究,2018-06-21,海本禄,正高级,河南师范大学,,河南,高等院校、其他学校,,,,,,,,,
5,18AGL006,重点项目,管理学,众创空间培育机制及发展策略研究,2018-06-21,卫武,正高级,武汉大学,985高校211高校,湖北,高等院校、其他学校,,,,,,,,,
6,18AGL007,重点项目,管理学,基于雾霾治理视角的政府环境责任审计监督机制研究,2018-06-21,管亚梅,正高级,南京财经大学,,江苏,高等院校、其他学校,,,,,,,,,
7,18AGL008,重点项目,管理学,新时期农村居民财产性收入扶贫模式的财务运作创新研究,2018-06-21,伍中信,正高级,湖南财政经济学院,,湖南,高等院校、其他学校,,,,,,,,,
8,18AGL009,重点项目,管理学,新时代资本市场背景下去产能的会计财务研究,2018-06-21,刘斌,正高级,重庆大学,985高校211高校,重庆,高等院校、其他学校,,,,,,,,,
9,18AGL010,重点项目,管理学,移动互联背景下中国食品企业社会责任问题与治理策略研究,2018-06-21,余伟萍,正高级,四川大学,985高校211高校,四川,高等院校、其他学校,,,,,,,,,
10,18AGL011,重点项目,管理学,互联网平台型企业社会责任问题研究,2018-06-21,肖红军,副高级,中国社会科学院,,社科院,中国社会科学院,,,,,,,,,
11,18AGL012,重点项目,管理学,新时代技能人才工匠精神研究,2018-06-21,叶龙,正高级,北京交通大学,211高校,高校,高等院校、其他学校,,,,,,,,,
12,18AGL013,重点项目,管理学,中国旅游产业转型升级动态演进研究,2018-06-21,魏敏,正高级,厦门大学,985高校211高校,福建,高等院校、其他学校,,,,,,,,,
13,18AGL014,重点项目,管理学,小农户和现代农业发展有机衔接的机制研究,2018-06-21,邹伟,正高级,南京农业大学,211高校,江苏,高等院校、其他学校,,,,,,,,,
14,18AGL015,重点项目,管理学,农户参与农村生活垃圾处理及其对处理效率影响的研究,2018-06-21,王成军,正高级,浙江农林大学,,浙江,高等院校、其他学校,,,,,,,,,
15,18AGL016,重点项目,管理学,促进能源转型的能源体制革命理论框架与实现机制研究,2018-06-21,朱彤,副高级,中国社会科学院,,社科院,中国社会科学院,,,,,,,,,
16,18AGL017,重点项目,管理学,国家公园生态环境监管体制改革研究,2018-06-21,温作民,正高级,南京林业大学,,江苏,高等院校、其他学校,,,,,,,,,
17,18AGL018,重点项目,管理学,多结构转型社会的老年长期照护保障资源整合研究,2018-06-21,戴卫东,正高级,浙江财经大学,,浙江,高等院校、其他学校,,,,,,,,,
18,18AGL019,重点项目,管理学,习近平新时代以人民为中心的民生发展思想研究,2018-06-21,唐任伍,正高级,浙江师范大学,,浙江,高等院校、其他学校,,,,,,,,,
19,18AGL020,重点项目,管理学,国家创新型试点城市的政府创新治理研究,2018-06-21,章文光,正高级,北京师范大学,985高校211高校,高校,高等院校、其他学校,,,,,,,,,
,项目批准号,项目类别,学科分类,项目名称,立项时间,项目负责人,专业职务,工作单位,单位类别,所在省区市,所属系统,成果名称,成果形式,成果等级,结项时间,结项证书号,出版社,出版时间,作者,获奖情况
0,18AGL021,重点项目,管理学,基于学科生产能力提升的一流学科建设路径和策略研究,2018-06-21,刘小强,正高级,江西师范大学,,江西,高等院校、其他学校,,,,,,,,,
1,18AGL022,重点项目,管理学,政策循环框架下深度贫困地区精准脱贫长效机制研究,2018-06-21,郑双怡,正高级,四川大学,985高校211高校,四川,高等院校、其他学校,,,,,,,,,
2,18AGL023,重点项目,管理学,基于研究联合体的国家自主创新示范区创新生态系统升级路径研究,2018-06-21,马宗国,正高级,济南大学,,山东,高等院校、其他学校,,,,,,,,,
3,18AGL024,重点项目,管理学,文化创意的价值管理研究,2018-06-21,杨永忠,正高级,四川大学,985高校211高校,四川,高等院校、其他学校,,,,,,,,,
4,18AGL025,重点项目,管理学,新时代工业文化遗产保护、利用的理论与方法研究,2018-06-21,王林,正高级,上海交通大学,985高校211高校,上海,高等院校、其他学校,,,,,,,,,
5,18AGL026,重点项目,管理学,加强新时代全民国防教育研究,2018-06-21,杜健,正高级,军事科学院,,军队,军队系统(包括地方军队院校),,,,,,,,,
6,18AGL027,重点项目,管理学,习近平军民融合发展战略思想体系研究,2018-06-21,黄朝峰,正高级,国防科技大学,,军队,军队系统(包括地方军队院校),,,,,,,,,
7,18AGL028,重点项目,管理学,效率视角下军民融合协同创新实现机制研究,2018-06-21,王子龙,正高级,南京航空航天大学,211高校,江苏,高等院校、其他学校,,,,,,,,,
8,18BGL001,一般项目,管理学,大数据背景下工程项目围标串标预警与治理机制研究,2018-06-21,程铁信,正高级,天津工业大学,,天津,高等院校、其他学校,,,,,,,,,
9,18BGL002,一般项目,管理学,大数据环境下商务数据质量评价与控制研究,2018-06-21,杨峰,中级,贵州财经大学,,贵州,高等院校、其他学校,,,,,,,,,
10,18BGL003,一般项目,管理学,基于时隙的航空公司不正常航班协同恢复理论与方法研究,2018-06-21,陈可嘉,正高级,福州大学,211高校,福建,高等院校、其他学校,,,,,,,,,
11,18BGL004,一般项目,管理学,农业天气指数保险建模及其政策支撑研究,2018-06-21,王娓娓,副高级,南京信息工程大学,,江苏,高等院校、其他学校,,,,,,,,,
12,18BGL005,一般项目,管理学,网络舆情分析在交通运输行业“智”理中的应用方法研究,2018-06-21,滕靖,正高级,同济大学,985高校211高校,上海,高等院校、其他学校,,,,,,,,,
13,18BGL006,一般项目,管理学,新时代中国特色社会主义流域生态文明理论研究,2018-06-21,文传浩,正高级,重庆工商大学,,重庆,高等院校、其他学校,,,,,,,,,
14,18BGL007,一般项目,管理学,“一带一路”背景下中欧班列供给侧改革与协同发展研究,2018-06-21,张军,正高级,重庆工商大学,,重庆,高等院校、其他学校,,,,,,,,,
15,18BGL008,一般项目,管理学,风险管理视阈下山地灾害避险搬迁安置决策与耦合机制研究,2018-06-21,陈勇,正高级,四川大学,985高校211高校,四川,高等院校、其他学校,,,,,,,,,
16,18BGL009,一般项目,管理学,海洋碳汇渔业绿色发展的外溢效应评价方法与补偿政策研究,2018-06-21,徐敬俊,副高级,中国海洋大学,985高校211高校,山东,高等院校、其他学校,,,,,,,,,
17,18BGL010,一般项目,管理学,基于大数据的超大城市多主体协同处置突发事件机理研究,2018-06-21,赵欢,副高级,北京第二外国语学院,,北京,高等院校、其他学校,,,,,,,,,
18,18BGL011,一般项目,管理学,基于国际金融主导权的大国货币博弈研究,2018-06-21,张应华,中级,九江学院,,江西,高等院校、其他学校,,,,,,,,,
19,18BGL012,一般项目,管理学,制度距离对全球供应链战略选择与竞争优势的影响研究,2018-06-21,张敬,副高级,河北工业大学,211高校,河北,高等院校、其他学校,,,,,,,,,
,项目批准号,项目类别,学科分类,项目名称,立项时间,项目负责人,专业职务,工作单位,单位类别,所在省区市,所属系统,成果名称,成果形式,成果等级,结项时间,结项证书号,出版社,出版时间,作者,获奖情况
0,18BGL013,一般项目,管理学,“科技冷战”背景下中国网络安全技术赶超的关键问题研究,2018-06-21,谢安世,中级,浙江工业大学,,浙江,高等院校、其他学校,,,,,,,,,
1,18BGL014,一般项目,管理学,产业回报型众筹的目标延展和激励机制研究,2018-06-21,刘晓峰,副高级,中南财经政法大学,211高校,湖北,高等院校、其他学校,,,,,,,,,
2,18BGL015,一般项目,管理学,基于能力模型的我国新兴产业培育路径与绩效比较研究,2018-06-21,龚惠群,中级,南京信息工程大学,,江苏,高等院校、其他学校,,,,,,,,,
3,18BGL016,一般项目,管理学,网络效应视角下中国电动汽车产业的演化机理与培育政策研究,2018-06-21,孙晓华,正高级,大连理工大学,985高校211高校,辽宁,高等院校、其他学校,,,,,,,,,
4,18BGL017,一般项目,管理学,乡村振兴战略下现代农业服务供应链协同机制研究,2018-06-21,张德海,正高级,重庆工商大学,,重庆,高等院校、其他学校,,,,,,,,,
5,18BGL018,一般项目,管理学,新时代物流业高质量发展的动力变革研究,2018-06-21,王健,正高级,福州大学,211高校,福建,高等院校、其他学校,,,,,,,,,
6,18BGL019,一般项目,管理学,制造业服务化与产业价值链升级研究,2018-06-21,郝凤霞,副高级,同济大学,985高校211高校,上海,高等院校、其他学校,,,,,,,,,
7,18BGL020,一般项目,管理学,中国特色军民融合深度发展演化机理及其实施路径研究,2018-06-21,方炜,副高级,西北工业大学,985高校211高校,陕西,高等院校、其他学校,,,,,,,,,
8,18BGL021,一般项目,管理学,“一带一路”倡议下我国企业集群式投资战略与全球价值链重构研究,2018-06-21,岳中刚,正高级,南京邮电大学,,江苏,高等院校、其他学校,,,,,,,,,
9,18BGL022,一般项目,管理学,“一带一路”倡议下中国企业国际化的战略与机制研究,2018-06-21,冯帆,副高级,南京大学,985高校211高校,江苏,高等院校、其他学校,,,,,,,,,
10,18BGL023,一般项目,管理学,“一带一路”国家劳动保护制度对中国企业对外直接投资效率的影响研究,2018-06-21,王雷,中级,兰州大学,985高校211高校,甘肃,高等院校、其他学校,,,,,,,,,
11,18BGL024,一般项目,管理学,全球价值链重构背景下中国制造企业跨国并购后的控制策略研究,2018-06-21,乐琦,副高级,华南师范大学,211高校,广东,高等院校、其他学校,,,,,,,,,
12,18BGL025,一般项目,管理学,我国互联网企业参与“一带一路”建设的模式与推进机制研究,2018-06-21,胡保亮,正高级,杭州电子科技大学,,浙江,高等院校、其他学校,,,,,,,,,
13,18BGL026,一般项目,管理学,制度落差对中国海外投资企业社会责任的影响研究,2018-06-21,陈怀超,副高级,太原理工大学,211高校,山西,高等院校、其他学校,,,,,,,,,
14,18BGL027,一般项目,管理学,基础研究强度的创新质量效应及最优区间研究,2018-06-21,黄苹,正高级,广东金融学院,,广东,高等院校、其他学校,,,,,,,,,
15,18BGL028,一般项目,管理学,基于生态化网络结构的平台治理及协同创新机制研究,2018-06-21,戴勇,正高级,湖北工业大学,,湖北,高等院校、其他学校,,,,,,,,,
16,18BGL029,一般项目,管理学,技术风口下商业模式创新预测及对策研究,2018-06-21,李向前,副高级,安徽工业大学,,安徽,高等院校、其他学校,,,,,,,,,
17,18BGL030,一般项目,管理学,军民科技融合网络的创新催化机制研究,2018-06-21,王育晓,副高级,西安工业大学,,陕西,高等院校、其他学校,,,,,,,,,
18,18BGL031,一般项目,管理学,平台型企业商业模式创新迭代过程的合法性测评及其应用研究,2018-06-21,徐天舒,副高级,苏州科技大学,,江苏,高等院校、其他学校,,,,,,,,,
19,18BGL032,一般项目,管理学,世界级制造业创新生态系统知识优势形成机理与培育政策研究,2018-06-21,赵长轶,副高级,四川大学,985高校211高校,四川,高等院校、其他学校,,,,,,,,,
,项目批准号,项目类别,学科分类,项目名称,立项时间,项目负责人,专业职务,工作单位,单位类别,所在省区市,所属系统,成果名称,成果形式,成果等级,结项时间,结项证书号,出版社,出版时间,作者,获奖情况
0,18BGL033,一般项目,管理学,新时代我国西部地区军民融合创新生态系统演化机理及发展战略研究,2018-06-21,缪小明,正高级,西北工业大学,985高校211高校,陕西,高等院校、其他学校,,,,,,,,,
1,18BGL034,一般项目,管理学,研发联盟惯例治理功能及其对区域创新的作用路径研究,2018-06-21,刘景东,中级,安徽大学,211高校,安徽,高等院校、其他学校,,,,,,,,,
2,18BGL035,一般项目,管理学,中国淘宝村包容性创新模式、机理及演化路径研究,2018-06-21,范轶琳,正高级,浙江树人学院,,浙江,高等院校、其他学校,,,,,,,,,
3,18BGL036,一般项目,管理学,创新型国家建设背景下我国高校科研人员学术创业行为的驱动机理与促进政策研究,2018-06-21,王季,副高级,辽宁大学,211高校,辽宁,高等院校、其他学校,,,,,,,,,
4,18BGL037,一般项目,管理学,促进绿色技术创新及应用的专利制度评价及优化研究,2018-06-21,刘珊,中级,浙江工业大学,,浙江,高等院校、其他学校,,,,,,,,,
5,18BGL038,一般项目,管理学,高校专利技术转移的实现机理及推进策略研究,2018-06-21,康旭东,正高级,大连理工大学,985高校211高校,辽宁,高等院校、其他学校,,,,,,,,,
6,18BGL039,一般项目,管理学,后追赶阶段我国企业面向先进制造业的技术赶超研究,2018-06-21,李林,正高级,重庆邮电大学,,重庆,高等院校、其他学校,,,,,,,,,
7,18BGL040,一般项目,管理学,基于范式相似度的“一带一路”国家科技创新政策比较研究,2018-06-21,赵付春,副高级,上海社会科学院,,上海,省、市社会科学院,,,,,,,,,
8,18BGL041,一般项目,管理学,科技成果转化过程中分类型视角下中试环节有效运行实现机制研究,2018-06-21,林筠,正高级,西安理工大学,,陕西,高等院校、其他学校,,,,,,,,,
9,18BGL042,一般项目,管理学,中国本土情境下适老产业技术创新实现机理与引导政策研究,2018-06-21,徐雨森,正高级,大连理工大学,985高校211高校,辽宁,高等院校、其他学校,,,,,,,,,
10,18BGL043,一般项目,管理学,基于能力匹配与行为协同的高新技术企业合作创新绩效研究,2018-06-21,刘和东,正高级,南京工业大学,,江苏,高等院校、其他学校,,,,,,,,,
11,18BGL044,一般项目,管理学,基于组织结构视角的平台型组织创新能力提升研究,2018-06-21,花磊,中级,南京信息工程大学,,江苏,高等院校、其他学校,,,,,,,,,
12,18BGL045,一般项目,管理学,健康中国战略下企业创新药研发激励与政策优化研究,2018-06-21,张新鑫,中级,天津理工大学,,天津,高等院校、其他学校,,,,,,,,,
13,18BGL046,一般项目,管理学,中小企业生态创新的驱动因素与绩效转化机制研究,2018-06-21,陈奎庆,正高级,常州大学,,江苏,高等院校、其他学校,,,,,,,,,
14,18BGL047,一般项目,管理学,组织即兴视角下的创业企业成长战略研究,2018-06-21,张晗,副高级,首都经济贸易大学,,北京,高等院校、其他学校,,,,,,,,,
15,18BGL048,一般项目,管理学,超网络视角下众创空间生态系统协同演化路径及治理机制研究,2018-06-21,王庆金,正高级,青岛大学,,山东,高等院校、其他学校,,,,,,,,,
16,18BGL049,一般项目,管理学,初始网络禀赋、网络中间人桥接与大学生创业成长研究,2018-06-21,李爱国,正高级,重庆理工大学,,重庆,高等院校、其他学校,,,,,,,,,
17,18BGL050,一般项目,管理学,创业拼凑驱动下裂变型新创企业的商业模式生成及演变研究,2018-06-21,蒋兵,中级,山东理工大学,,山东,高等院校、其他学校,,,,,,,,,
18,18BGL051,一般项目,管理学,互联网情境下科技创业者社会关系网络与融资绩效关系研究,2018-06-21,王泽宇,中级,中国社会科学院,,社科院,中国社会科学院,,,,,,,,,
19,18BGL052,一般项目,管理学,基于生态工程参与的贫困人口创业驱动机理与实现路径研究,2018-06-21,陈建成,正高级,北京林业大学,211高校,高校,高等院校、其他学校,,,,,,,,,
,项目批准号,项目类别,学科分类,项目名称,立项时间,项目负责人,专业职务,工作单位,单位类别,所在省区市,所属系统,成果名称,成果形式,成果等级,结项时间,结项证书号,出版社,出版时间,作者,获奖情况
0,18BGL053,一般项目,管理学,新时代企业家精神对大学生创业意向转化为行为的影响机制研究,2018-06-21,梅虎,正高级,华南师范大学,211高校,广东,高等院校、其他学校,,,,,,,,,
1,18BGL054,一般项目,管理学,地方政府隐性债务“灰犀牛”风险的协同审计治理研究,2018-06-21,刘骅,正高级,南京审计大学,,江苏,高等院校、其他学校,,,,,,,,,
2,18BGL055,一般项目,管理学,减持计划预披露、信息含量与内幕交易新模式研究,2018-06-21,朱茶芬,副高级,浙江大学,985高校211高校,浙江,高等院校、其他学校,,,,,,,,,
3,18BGL056,一般项目,管理学,政府公信力的影响机制、评价维度及提升对策研究,2018-06-21,吴晶妹,正高级,中国人民大学,985高校211高校,高校,高等院校、其他学校,,,,,,,,,
4,18BGL057,一般项目,管理学,政府与社会资本合作模式回报机制的规范化构建研究,2018-06-21,宋健民,副高级,郑州大学,211高校,河南,高等院校、其他学校,,,,,,,,,
5,18BGL058,一般项目,管理学,中国经济发展新动能匹配的税务营商环境优化研究,2018-06-21,姚维保,副高级,广东财经大学,,广东,高等院校、其他学校,,,,,,,,,
6,18BGL059,一般项目,管理学,大数据背景下金融与科技融合机理及风险管控研究,2018-06-21,田秀娟,正高级,对外经济贸易大学,211高校,高校,高等院校、其他学校,,,,,,,,,
7,18BGL060,一般项目,管理学,基于核心企业主导的供应链金融与实体经济深度融合研究,2018-06-21,李善良,正高级,苏州大学,211高校,江苏,高等院校、其他学校,,,,,,,,,
8,18BGL061,一般项目,管理学,基于生命周期的中国科技金融支持体系创新研究,2018-06-21,王黎明,正高级,山东理工大学,,山东,高等院校、其他学校,,,,,,,,,
9,18BGL062,一般项目,管理学,基于政府公信力视角的公共养老保险基金投资绩效评价及相关信息披露研究,2018-06-21,常丽,正高级,东北财经大学,,辽宁,高等院校、其他学校,,,,,,,,,
10,18BGL063,一般项目,管理学,金融创新背景下多目标公司治理投资支持实体经济研究,2018-06-21,齐岳,正高级,南开大学,985高校211高校,天津,高等院校、其他学校,,,,,,,,,
11,18BGL064,一般项目,管理学,实体企业业绩承诺与金融风险的机制、后果与防控研究,2018-06-21,张继德,副高级,北京工商大学,,北京,高等院校、其他学校,,,,,,,,,
12,18BGL065,一般项目,管理学,供应链关系对股价崩盘风险的影响机理与经济后果研究,2018-06-21,尹洪英,副高级,苏州大学,211高校,江苏,高等院校、其他学校,,,,,,,,,
13,18BGL066,一般项目,管理学,上市公司并购重组“高溢价高业绩承诺”的动因及经济后果研究,2018-06-21,索玲玲,中级,北京联合大学,,北京,高等院校、其他学校,,,,,,,,,
14,18BGL067,一般项目,管理学,上市公司会计舞弊风险指数构建、预警及影响因素研究,2018-06-21,李清,正高级,吉林大学,985高校211高校,吉林,高等院校、其他学校,,,,,,,,,
15,18BGL068,一般项目,管理学,并购重组业绩补偿承诺的负面效应与监管策略研究,2018-06-21,刘建勇,副高级,中国矿业大学,,江苏,高等院校、其他学校,,,,,,,,,
16,18BGL069,一般项目,管理学,财务柔性、内控质量与企业价值研究,2018-06-21,张凌,正高级,铜陵学院,,安徽,高等院校、其他学校,,,,,,,,,
17,18BGL070,一般项目,管理学,城市社会经济资源对独立董事治理的影响机理研究,2018-06-21,周军,副高级,山东大学,985高校211高校,山东,高等院校、其他学校,,,,,,,,,
18,18BGL071,一般项目,管理学,供给侧结构性改革进程中企业绩效提升研究,2018-06-21,朱清香,正高级,河北工业大学,211高校,河北,高等院校、其他学校,,,,,,,,,
19,18BGL072,一般项目,管理学,基于同群效应的企业创新投资行为传导机理研究,2018-06-21,马春爱,正高级,中国石油大学（北京）,,高校,高等院校、其他学校,,,,,,,,,
,项目批准号,项目类别,学科分类,项目名称,立项时间,项目负责人,专业职务,工作单位,单位类别,所在省区市,所属系统,成果名称,成果形式,成果等级,结项时间,结项证书号,出版社,出版时间,作者,获奖情况
0,18BGL073,一般项目,管理学,企业盈利水平的地区行业差异与平衡充分发展研究,2018-06-21,李连军,正高级,南京财经大学,,江苏,高等院校、其他学校,,,,,,,,,
1,18BGL074,一般项目,管理学,生态文明建设背景下高排放企业碳成本控制及其运行机制研究,2018-06-21,张彩平,副高级,南华大学,,湖南,高等院校、其他学校,,,,,,,,,
2,18BGL075,一般项目,管理学,簿记技术变革与社会变迁研究,2018-06-21,吴大新,副高级,山东财经大学,,山东,高等院校、其他学校,,,,,,,,,
3,18BGL076,一般项目,管理学,会计信息质量、股票风险溢价与股价崩盘预警机制研究,2018-06-21,周蕾,副高级,安徽财经大学,,安徽,高等院校、其他学校,,,,,,,,,
4,18BGL077,一般项目,管理学,基于价值链理论的企业质量成本管理与分担机制研究,2018-06-21,李百兴,正高级,首都经济贸易大学,,北京,高等院校、其他学校,,,,,,,,,
5,18BGL078,一般项目,管理学,内部控制缺陷、制度环境与高管腐败及其治理机制研究,2018-06-21,陈林荣,副高级,浙江工商大学,,浙江,高等院校、其他学校,,,,,,,,,
6,18BGL079,一般项目,管理学,内部控制提升国有企业全要素生产率的机制与路径研究,2018-06-21,王加灿,副高级,南昌大学,211高校,江西,高等院校、其他学校,,,,,,,,,
7,18BGL080,一般项目,管理学,内部控制质量、管理层信息操纵与股价稳定研究,2018-06-21,黄政,中级,湖南商学院,,湖南,高等院校、其他学校,,,,,,,,,
8,18BGL081,一般项目,管理学,大数据情境下国有企业高管层激励与监管动态耦合研究,2018-06-21,邵剑兵,正高级,辽宁大学,211高校,辽宁,高等院校、其他学校,,,,,,,,,
9,18BGL082,一般项目,管理学,动态能力视角财务柔性对企业开放式创新绩效作用机理研究,2018-06-21,王文华,副高级,常州大学,,江苏,高等院校、其他学校,,,,,,,,,
10,18BGL083,一般项目,管理学,共享经济下的企业资源贡献行为及企业间协同机制研究,2018-06-21,孙永波,正高级,北京工商大学,,北京,高等院校、其他学校,,,,,,,,,
11,18BGL084,一般项目,管理学,互联网集团生态成长中的治理模式研究,2018-06-21,刘素,副高级,山东财经大学,,山东,高等院校、其他学校,,,,,,,,,
12,18BGL085,一般项目,管理学,混合所有制改革的“双向混合”与提升企业风险承担能力：理论与实证研究,2018-06-21,张娆,副高级,东北财经大学,,辽宁,高等院校、其他学校,,,,,,,,,
13,18BGL086,一般项目,管理学,基于环境审计的企业环境管理决策模式研究,2018-06-21,张艳,正高级,湖南商学院,,湖南,高等院校、其他学校,,,,,,,,,
14,18BGL087,一般项目,管理学,基于社会—商业双重属性的网约车平台治理研究,2018-06-21,葛建新,正高级,中央财经大学,211高校,高校,高等院校、其他学校,,,,,,,,,
15,18BGL088,一般项目,管理学,家族控制、合作偏好与私营企业成长机制研究,2018-06-21,李婧,副高级,上海政法学院,,上海,高等院校、其他学校,,,,,,,,,
16,18BGL089,一般项目,管理学,军民深度融合下民参军企业的价值链攀升机理及实现路径研究,2018-06-21,张冬敏,副高级,西安工业大学,,陕西,高等院校、其他学校,,,,,,,,,
17,18BGL090,一般项目,管理学,新时代背景下跨层次公司社会网络对双元创新的影响研究,2018-06-21,刘亭立,正高级,北京工业大学,211高校,北京,高等院校、其他学校,,,,,,,,,
18,18BGL091,一般项目,管理学,中国情境下学者独董参与治理、影响机制与企业经济后果研究,2018-06-21,向锐,正高级,四川大学,985高校211高校,四川,高等院校、其他学校,,,,,,,,,
